Timestamp,Email address,sba,fr
19/08/2022 18:42:29,,Tō dèné gɨ́ gɔ̀jì dúmsú bàá yàá ɓá tì-á ɓār yā̰ nò̰ó̰,C'est une femme très courte qui parle beaucoup là
19/08/2022 18:42:51,,M-ḭ́ dɔ̀ kāgɨ̄ gɨ́ m-ō-sō ndáà dūn-ḿ ndàng,Je suis tombé de l'arbre et je me suis cassé le bassin
19/08/2022 18:43:19,,Dùndā dɨ́ nè ī-tò ɓī dɨ̀ màjé yàá wà?,Pendant la nuit as-tu bien dormi?
19/08/2022 18:43:46,,ùnjà dùrùrù gāng,Il le coupe en gros morceaux
19/08/2022 18:44:09,,Də̀w̄ gɨ́ dùsù,une personne extraordinaire
19/08/2022 18:44:37,,ɗí m-ā kàr̄-é wà?,Que vais-je lui donner? 
19/08/2022 18:45:37,,Dḛ́ d-ár-é né sɔ̀,Ils lui ont donné à manger
19/08/2022 18:45:57,,Ngōn-é rī-á tē-é,Son enfant est malade
19/08/2022 18:46:22,,D-ó ngá lə̀ èl̄-bò jē dɔ̀ màsɨ̄ dɨ́,Ils aperçoivent les petits du Gros-Oiseau (perché) sur un tamarinier
19/08/2022 18:46:48,,ḛ̀ ɓá m-ē-é ə̀ĺ ɓí,"Lui-là, je ne l'ai pas encore vu"
19/08/2022 18:47:14,,ḛ̀-ń dá m̄-gə̀r̄ ə̀ĺ,Ça je ne sais pas
19/08/2022 18:47:45,,ḛ̀ gɨ́ ngàw dèné jē lé ə̀njī pà nà kúrā-màr̄-é-nè lé ùn tànjì lə̀-nè à̰ӯ-dɨ́ àw̄,Celui qui est le mari de la femme là pense que son ami avait pris la pintade et avait fuit avec
19/08/2022 18:48:20,,ī-tèē gɨ̀ ḛ̀ gɨ́ ɗàng là,Maintenant tu joues une autre
19/08/2022 18:48:49,,"ḛ̀ḛ̄, tō kɨ́ lə̀-sí yàá láy"," Oui, c'est bien le nôtre à nous tous"
19/08/2022 18:49:17,,"m-ə́dɨ́, ə́dɨ́, ə̀dɨ́","je me trouve, tu te trouves, il se trouve"
19/08/2022 18:49:41,, ḭ́yá̰-m̄ ā-m̄ m-ə̄jī tà lám ɓá,Laisse-moi réfléchir un peu d'abord
19/08/2022 18:50:01,,Jḛ̀ tō njè-ɓògò jē ə̀ĺ,Nous ne sommes pas des voleurs
19/08/2022 18:50:18,,Dùndā dɨ́ nè m̄-tò ɓī dɨ̀ màjé ə̀ĺ,Cette nuit je n'ai pas bien dormi
19/08/2022 18:50:33,,úlā jī-í ə̀m-í dɨ́ ə̀ĺ,Ne mets pas le doigt dans le nez
19/08/2022 18:50:52,,úlā jī-í ɗə́w ə̀m-í gɨ́ ə̀ĺ,Ne met-pas le doigt dans le nez
19/08/2022 18:51:13,,Ndɔ̄ kárā ùwà ə̄m ìlā kùlā gɔ́s-é dɨ́ àw̄ ìngà-né mbàw lé,"Un jour il a attrapé un lièvre, lui a mis une corde au cou, et l'a amené pour trouver le pêcheur"
19/08/2022 18:51:35,,ə̄m lé tō dā gɨ́ mbī-á ngāl yā̰ lə́m gōsū lə̀-á ḛ̀ yā̰ lə́m tɔ̀,"Le lièvre est un animal avec les oreilles longues, et il est très malin"
19/08/2022 18:51:53,, ī dá ə́mə̄ yā̰,Toi tu te presses trop
19/08/2022 18:52:15,,Kə́r lé ə̀mɨ̀,Le sésame (pilé) devient graisseux
19/08/2022 18:52:37,,Dā nè lé ə̀mɨ̀ yā̰,Cette viande a beaucoup de graisse
19/08/2022 18:52:59,,Lò-gɨ́ ndābɨ́ ə̀n̄ màn̄ ndáà tḛ̀ḛ̄ kànàng ə̀ĺ,"Quand le canard pénètre dans l'eau, il ne sort pas vite"
19/08/2022 18:53:16,,Ngōn lé ə̀ndɨ̀ sḭ̀,L'enfant a pété
19/08/2022 18:53:32,,Né ə̀ndɨ̀ màjə̀ĺ nè,Quelque chose sent mauvais ici
19/08/2022 18:53:53,,Mò̰y lé jɔ̄gɨ̄ kúrā-màr̄-ḿ yā̰ àr̄-é ə̀ngə̄,La maladie a dérangé mon ami à tel point qu'il a beaucoup maigri
19/08/2022 18:54:14,,Sɔ̀ né yā̰ nḛ̀ ə̀ngə̄ kə́ng-kə́ng,Il mange beaucoup mais il est toujours très maigre
19/08/2022 18:54:32,,Kúrā-màr̄-é lé ə̀njī pà nà àw̄ kórō-nè mbā tɔ̄l-nè,Son ami pense qu'il le chasse pour le tuer
19/08/2022 18:55:02,,ḭ́yá̰ mā̰ m-ə̄njī tà lám ɓá.,Laisse-moi réfléchir un peu d'abord
19/08/2022 18:55:20,,Ndɔ̄ gɨ́-ɗá ɓá ngàb-ḿ ə̀njī dɔ̀-ḿ dɨ́ wà?,Depuis quand mon mari pense-t-il à moi?
19/08/2022 18:55:38,,ɓāl kárā bè ndī ə̀r ə̀ĺ àr̄ ɓō ò̰ də̀w̄ jē yā̰ ngōn ɓē gɨ́ kárā bè,Une année la pluie n'était pas tombée et la faim rongeait les habitants d'un petit village
19/08/2022 18:55:56,,Ndī ə̀r yā̰ ɓō j-à dùbū né ɓōgɨ́-nè ə̀ĺ,Il pleut beaucoup alors nous ne pouvons pas semer aujourd'hui
19/08/2022 18:56:17,,"m-ā m-ə́r̄ ə̀dɨ̄, ī ə́r̄ ə̀dɨ̄, yḛ̀ ə̀r ə̀dɨ̄, jḛ̀ḛ̄ j-ə̀r ə̀dɨ̄","j'urine,tu urines,il urine,nous urinons "
19/08/2022 18:56:34,,"jḛ̀ḛ̄ j-ə̀r jē ə̀r̄, sḛ̀ḛ̄ ə́r jē ə̀r̄, dḛ́ӯ d-ə́r ə̀r̄-dɨ́ ","nous urinons, vous urinez, ils urinent"
19/08/2022 18:56:53,,Ngōn ə̀r ə̀dɨ̄ gìr kḭ́-á jē gɨ́,L'enfant a uriné sur le dos de sa mère
19/08/2022 18:57:15,,Ngōn lé ìlā-m̄ gè kɔ́rí ə̀r kàrī bàá yàá,L'enfant a jeté une pierre sur moi pour rien
19/08/2022 18:57:34,,M-ún ə̀r m-ílā-né yèl̄,Je prends une pierre pour lancer sur un oiseau
19/08/2022 18:57:51,,Màn̄g lə̀-á ə̀r ndòl-ndòl,Son boeuf est bien gras
19/08/2022 18:58:08,,"Lò gɨ́ ngúl lé ə̀r̄ mbá̰ dáà, ùlà jī-á dɨ̀ mbā kùn kárā nā̰","Une fois les ignames étaient cuites, il a mis la main pour prendre une et la goûter"
19/08/2022 18:58:25,,Sɔ́ dā nè ə̀ĺ nà ə̀r̄ ə̀ĺ,"Ne mange pas cette viande, elle n'est pas bien cuite"
19/08/2022 18:58:42,,Másàr lé ə̀r̄,Le maïs est mûr
19/08/2022 18:59:00,,Tə̰̄y lé ə̀r̄ kə̀m nò̰ wàā gɨ́,Le pénicillaire devient mûr avant le sorgho
19/08/2022 18:59:15,,Kō lé ə̀r kə̀m kə̀m kìnjà ngàá,Le mil est assez mûr pour récolter
19/08/2022 18:59:34,,ɓē lə̀ mə̀m-ḿ jē ə̀w,Le village de mon beau-père est loin
19/08/2022 18:59:56,,Kùr-í ə̀w yā̰,u as beaucoup tardé à revenir
19/08/2022 19:00:32,,ɗə́w ə̀b-m̄,Le chemin est long pour moi
19/08/2022 19:00:52,,Ndɔ̄ gɨ́-n̄ lé bɔ̀ɔ̄-dé jē ə̀w̄ k-àӯ kīdō gɨ̀ sà,"A partir de ce jour-là, leur père cessa de boire la bière et de fumer du tabac"
19/08/2022 19:01:09,,ə̄w rɔ̄-í tībī yūrō nàńg mbɔ̀r kə́y gɨ́ bè,Ne crache pas sur le sol à côte de la maison comme ça!
19/08/2022 19:01:27,,ə́ylépēlē tō yèl̄ gɨ́ bòý gɨ́ sɔ̀ ngán kīnjá jē,L'épervier est un grand oiseau qui mange les poussins
19/08/2022 19:01:46,,Né gɨ́ ā-m̄ lé ə̰̀y ə̀ĺ,Ce que tu m'as donné n'est pas suffisant
19/08/2022 19:02:11,,Mūnú ndùjī gàb-gàb,Il avale de la farine
19/08/2022 19:02:27,,Wōng ɗī-á àr̄-é àw̄ dɔ̀-ḿ dɨ́ gàbà-gàbà,Il est en colère contre moi
19/08/2022 19:02:55,,"ùwà gábɨ̀rà, ndə̀m̄ gɨ̀ kám àw̄ dɨ̀ kə́y lə̀-á","Il attrape un criquet, l'enveloppe dans des feuilles et le rapporte à la maison"
19/08/2022 19:03:13,,Gábɨ̀rà lé tō kùr̄ gɨ́ sɔ̀ kám kāgɨ̄,La sauterelle est un insecte qui mange les feuilles des herbes
19/08/2022 19:03:34,,Sé gādɨ̄ kòsɨ́ lə̀-í lé kándá wà?,Le prix de tes concombres est à combien?
19/08/2022 19:03:54,,Gádɨ́-màgār jē d-ílā jám d-úwā-né kə́m jē,Les araignées tissent des toiles pour attraper les mouches
19/08/2022 19:04:10,,Gágà lé tō yèl̄ gɨ́ ndà lə́m ndùl lə́m nè ɓə̄ĺ də̀w̄ jē yā̰,Le corbeau est un oiseau blanc et noir qui a beaucoup de peur des gens
19/08/2022 19:04:29,,ìngà gàgɨ̀ jōó bàá,Il a trouvé deux poisson-chats seulement
22/08/2022 00:26:01,,Dèné lé ɔ̀sɨ̀ gàjì njè-kùlà lə̀-á,La femme félicite son travailleur
22/08/2022 00:29:09,,Gàjì màn̄g Mbōrō ngāl yā̰ ùndā gàjì màn̄g jē gɨ́ ɗàng,Les cornes des boeufs Mbororo sont plus longues que celles des autres boeufs
22/08/2022 00:29:31,,è tō njè gàjì,C'est la responsable des amulettes
22/08/2022 00:29:56,,Bísī lé àndɨ̄ gál-ḿ gɨ́ à-m̄ m-tèē m-ōsō,Le chien courait entre mes jambes et m'a fait tomber
22/08/2022 00:32:31,,M-ún gáláw m-ár-é,Je le lui ai donné à contre coeur
22/08/2022 00:33:05,,M-ā gāng kùlā nòjī lə̀-sí,Je vais couper vos liens fraternels
22/08/2022 00:33:32,,m̄-gāng bā gɨ̀ tò,J'ai traversé le fleuve avec une pirogue
22/08/2022 00:33:57,,Gán̄g lé ɓār yā̰ ùndā kɔ̀dè,"Le tambour ""gang"" résonne plus fort que le tambour en deux faces"
22/08/2022 00:34:23,,Yḛ̀ ùndà gár-gō ngōn-é,Il a tapé son enfant sur la nuque
22/08/2022 00:35:02,,M-ndìbì pə̀r m-ār rɔ̄-ḿ gāw gáw-gáw,Je me suis bien réchauffé
22/08/2022 00:35:30,,Gàýrā lé tá nà̰ā̰ gɨ̀ màr nè ḛ̀ ngāl yā̰ ə̀ĺ,"Le palmier doum est pareil au rônier, mais il n'est pas si grand"
22/08/2022 00:35:55,,ɗā ɔ́jī né gà̰ ɗí wà?,En vertu de quoi as-tu fait cela?
22/08/2022 00:36:21,,Gà̰ā̰ gɔ̀l-í,Dresse-toi sur la pointe des pieds
22/08/2022 00:37:07,,Tōgɨ́ ī-gè dáà ā-m̄ gúsù dɔ̀-mùndá gìr-é mḭ́,"Si tu veux, donne-moi 175 francs (35 ""gours"")"
22/08/2022 00:37:27,,úwā də̄ gé,Mets-le à l'écart
22/08/2022 00:37:50,,Bɔ̀-ḿ jē tō gèl,Mon père est gaucher
22/08/2022 00:38:24,,Gèl-é tò gɨ́-n̄,Il a son défaut
22/08/2022 00:38:50,,Gél ɓɔ́l lə̀-ḿ mbùdù,Le fond de ma poche est percé
22/08/2022 00:39:12,,Sóò lé òsō gél màn̄ bùlà gɨ́,Le seau est tombé au fond du puits
22/08/2022 00:39:35,,"Kártɨ̀ gél sɔ́: jìnárì tɔ̀, sènégɨ̀ tɔ̀, kóbì tɔ̀, sùbátà tɔ̀","Il y a quatre couleurs: carreau, trèfle, coeur et pique"
22/08/2022 00:39:59,,"Dìngàm kárā ùl̄ kūnjá jē yā̰, dáà kūnjá jē lé gél-dé ɓə́dɨ́ ɓə́dɨ́","Un homme élevait beaucoup de poules, et les poules étaient des espèces différentes"
22/08/2022 00:40:21,,Būr ùndà gél kɔ̀sɨ̀ pā,Le varan commença à chanter
22/08/2022 00:40:42,,Bāgɨ̄ yèl̄ nè lé tə̀dɨ̀ gél-é gɨ́ nè ɓá yḛ̀ òsō-né nàńg,"L'aile de cet oiseau s'est cassée en dessous, c'est pourquoi il est tombé"
22/08/2022 00:41:08,,Kúrā-màr̄-ḿ ùndā-m̄ gél-tà-ḿ gɨ́ ìlā-m̄ nàńg,Mon ami m'a frappé au menton et m'a terrassé
22/08/2022 00:41:46,,àr ùy gèng,"Il reste pensif, hésitant"
22/08/2022 00:42:06,,Gèsɨ̄-é jē dá tō mṵ̀ yàá láy,"Le reste (des cartes) est du ""foin"""
22/08/2022 00:42:28,,Sé āw gə̄ ɗá wà? M-āw gə̄ súgɨ̀ gɨ́,Vers où tu te diriges? Je vais vers le marché
22/08/2022 00:42:54,,"ḭ̀ gə̄ ɗá ɗá kàrà, də̀w̄ gə̀r̄ ə̀ĺ","Il vient d'où, on n'en sait rien"
22/08/2022 00:43:15,,Njè-kɔ̀r̄ lé ùn ngàw-làr ɗā gə̄ kɔ̀sɨ̀,Le forgeron a pris un morceau de fer et en a forgé une houe
22/08/2022 00:43:40,,Tō gə̄ mbáy,Il est un chef
22/08/2022 00:44:07,,Ndī mbél màn̄ gə̄ mbél,Il y a eu une pluie torrentielle
22/08/2022 23:25:12,,ùwà dɔ̀ kāgɨ̄ gə̀bə̀rə̀ ìsì dɨ́,Il se pose bien sur un arbre
22/08/2022 23:25:39,,Tò dàn-á gə́dɨ́-gə́dɨ́,C'est bien en plein milieu
22/08/2022 23:26:02,,D-úwā nàńg gə̀dɨ̀rə̀-gə̀dɨ̀rə̀,On l'a retenu avec peine
22/08/2022 23:26:25,,Gə̀m bàl gɨ́ núngā lé lèl̄ yā̰,Les testicules du bouc grillés sont délicieux
22/08/2022 23:26:52,,Kə̀m-é tò gə̀ndə̀rə̀,Il a les yeux écarquillés
22/08/2022 23:27:12,,Gə́n̄g lé tō kùr̄ gɨ́ bòý yā̰ gɨ́ sɔ̀ ngán kùr̄ jē gɨ́ ɗàng,La mante religieuse est un insecte très grand qui mange beaucoup d'insectes plus petits
22/08/2022 23:27:40,,ún gə̀r̄ gɨ́ nè ām m̄-kōrē-né mùrū,Prend-moi ce spatule en bois pour que je puisse remuer la boule avec
22/08/2022 23:28:08,,Mā̰ m̄-gə̀r̄-dé ə̀ĺ,Je ne les connais pas
22/08/2022 23:28:28,,Sé ī-gə̀r̄-é wà? ,Est-ce que tu le connais?
22/08/2022 23:28:50,,m̄-gə̀r̄ ə̀ĺ ɓí,Je ne sais pas encore.VT comprendre
22/08/2022 23:29:19,,Dèné jē lé d-úr gə́r mbā tá gɨ́ bíyā,Les femmes creusent la racine du tapioca pour faire la bouillie
22/08/2022 23:30:58,,Də̀w̄ kùndà ngōn dɔ̀ gə́r yégɨ̄ dɨ́ lì-á ə̀ĺ,On ne frappe pas l'enfant sur la tombe de son souris
22/08/2022 23:31:21,,àr nàńg gə̀s,Il s'arrête dignement
22/08/2022 23:31:42,,Bìrī lé gél-é tò gə́ẁ,Le fond de ce mortier (neuf) est plat
22/08/2022 23:32:03,,Gə̰́y né ndām ɗí-á dɨ́ ngàā,Il a déjà cessé de porter (régulièrement) sa tenue d'initié
22/08/2022 23:32:26,,Sóò lé òsō gín màn̄ bùlà gɨ́,Le seau est tombé au fond du puits
22/08/2022 23:32:49,,Ngán jē d-áw ndām gìr kə́y gɨ́,Les enfants jouaient derrière la maison
22/08/2022 23:33:15,,āw tò gìr mbáy dɨ́,Va coucher à côté du roi
22/08/2022 23:33:39,,dɔ̀g-gìr-é-sɔ́,quatorze
22/08/2022 23:34:00,,à gɨ̀ kàw̄,Il s'apprête à aller
22/08/2022 23:34:18,,àw̄ gɨ̀ bɔ̀b-é,Il est parti avec son père
22/08/2022 23:34:38,,àw̄ gɨ̀ wōdɨ̄rō,Il est parti en voiture
22/08/2022 23:35:01,,Dḛ́ gɨ̀ dèné lə̀-á d-úsā ngúl lé nà̰ā̰ dɨ́,Lui et sa femme mangèrent les ignames ensemble
22/08/2022 23:35:36,,è ndìgì né-sɔ̀ gɨ́ làl̄ dā gɨ̀ kānjī,Il veut un repas sans viande et (sans) poisson
22/08/2022 23:35:59,,Jḛ̀ j-àw̄ gɨ̀ ngán jē ə̀ĺ,Nous n'avons pas des enfants
22/08/2022 23:37:02,,àw̄ sì né dɔ̀ pàĺ gɨ́,Il alla s'asseoir avec (la chose) sur le séchoir
22/08/2022 23:37:33,,ḛ̀ mbél kō lé mḛ̀ kèē gɨ́,Elle a versé le mil dans le van
22/08/2022 23:38:03,,Súgɨ̀ gɨ́ Mūndūú bòý yā̰ ùndā yè gɨ́ Sár̀,Le marché de Moundou est plus grand que celui de Sarh
22/08/2022 23:38:25,,Də̀w̄ gɨ́ ɓògò-m̄ lé tō ī à,La personne qui m'a volé était toi même
22/08/2022 23:39:20,,āw súgɨ̀ gɨ́ gɨ̀-mbā ndōgō ùbū,Va au marché pour acheter de l'huile
22/08/2022 23:40:02,,Dèné gɨ́-n̄ lé ò̰ mùrū lé gɨ̀ kárē-bàá láy,Cette femme là a mangé toute la boule seule
22/08/2022 23:40:34,,Ngōn lé ìlā-m̄ gɨ̀ ə̀r gɨ̄-ndāńg,L'enfant a jeté une pierre sur moi pour rien
22/08/2022 23:41:01,,ɓōlé ó̰ mùrū gɨ̀-ndɔ̄ɔ́ ndáà ā tò ɓī yā̰,"Si tu manges la boule le matin, tu dormiras beaucoup"
22/08/2022 23:41:20,,Mḛ̀ ɓē gɨ́-ɗá wà?,Dans quel village?
22/08/2022 23:41:44,,Sé bḭ̄yā̰ gɨ́-ɗá ɓá rī-á tī-é wà?,Laquelle chèvre est malade?
22/08/2022 23:42:19,,Sé ā ɗèē ndɔ̄ gɨ́-ɗá wà?,Quand vas-tu venir?
22/08/2022 23:42:40,,ɗí ɓá ā ɗā bèrè gɨ̀-sḭ́ wà?,Qu'est-ce que tu vas faire demain matin?
22/08/2022 23:43:04,,Bísī jē lé tò gō-dé dɨ́,Les chiens se couchèrent derrière eux
22/08/2022 23:43:25,,Tə̰̄y lé ə̀r kə̀m gō másàr gɨ́,Le petit mil devient mûr après le maïs
22/08/2022 23:43:59,,ḛ̀ ùndà gō ngōn-é,Il a tapé son enfant sur la nuque
22/08/2022 23:44:28,,àw̄ ndíl-í dɨ̀ mbā kàr̄-m̄ m-āw gō-é dɨ́,Il est allé à l'ombre pour que je le suive
22/08/2022 23:44:49,,"Ngà gō-gɨ́ ndáà, ā ɗā-né bàń?","Et après, qu'est-ce que tu en fais?"
22/08/2022 23:45:17,,ḭ́yá̰ dɨ̀ gō-ngāl-é ə̀ĺ,Ne le laisse pas sans surveillance
22/08/2022 23:45:51,,Rígɨ̀m ùn gòdɨ̀ gɔ̀l-é àw̄ sán̄g ngōn lé,L'hyène suivit les traces de ses pas et cherche l'enfant
22/08/2022 23:46:16,,Mbáy gòdó ɓē-é,Le chef n'est pas chez lui
22/08/2022 23:46:51,,Ngō-kó̰-í lé gòdó,Ton frère est absent
22/08/2022 23:47:14,,Né sɔ̀-sí gòdó,Il n'y a rien à manger pour nous
22/08/2022 23:47:40,,Sēngē lə̀-í gòdó wà?,Tu n'as pas de moustiquaire?
22/08/2022 23:48:01,,Dḛ́ gɨ́ d-áw kédé lé gə̀r̄ né gɨ́ tḛ̀ḛ̄ dɔ̀ dḛ́ gɨ́ nà̰y gògɨ́ lé ə̀ĺ,Ceux qui étaient avant n'ont pas vu ce qui est passé à ceux qui étaient derrière
22/08/2022 23:48:31,,"Jī dā gɨ́ kédé lé yàá òm būwá gɨ́ ɓá, ḛ̀ gɨ́ gògɨ́ à kòm būwá gɨ́ ɓə́y","Les pattes de devant tombent dans le trou d'abord, et les derrières vont tomber aussi"
22/08/2022 23:49:02,,Lò gɨ́ ā tél kàw̄ gògɨ́ ndáà ī-ɗèē ā-m̄ m-úlā-ī,"Quand tu partiras, viens ici, je te donnerai une commission"
22/08/2022 23:49:32,,Kūbū gɨ́ nèē lé tél ɗèē gògó,L'habit là est revenu à nouveau
22/08/2022 23:49:53,,Dèné àw̄ gól ngōn-é,La femme berçait son bébé
22/08/2022 23:50:20,,Njè-ndɔ̀ɔ̄ ùlà gólē gɨ̀ màn̄ kènéng sɔ́l-é gɨ́,"Le cultivateur met sa gourde ""gal"" pleine de l'eau sous les aisselles"
22/08/2022 23:50:50,,Tì-á gōrē jìm,Il a un rond de graisse sur la bouche
22/08/2022 23:51:17,,Gōrē lò ḭ̀yà̰,Laisser intact le lieu
22/08/2022 23:52:00,,ḛ̀ lé tō gōsō kòndè gɨ́ tɔ̄gɨ́rɔ̄,Il est un vrai de vrai artiste de la cithare
22/08/2022 23:52:24,,Njā ɗā gōsú ùlà də́r pà nà n-ḛ̀ ǹ-ɗèē dɨ̀ mbā kùndā rī ngán nān-nè,Le renard usa d'une ruse en disant au pigeon qu'il était venu pour donner des noms à ses neveux
22/08/2022 23:52:55,,M-gè də̀j-ī gōsū ɗā ùbū ɗɔ̄ý,Je voudrais te demander la façon de faire l'huile de karité
22/08/2022 23:53:25,,"Sé dàn-dé dɨ́ mùndá nè lé, ná̰ ɓá ɗā gōsū yā̰ wà?","De ces trois personnes, quelle a été la plus maligne?"
22/08/2022 23:53:48,,M-ɗèē dɨ̀ mbā gò̰ō̰-ī bàá yàá,Je suis venu tout simplement te rendre visite
22/08/2022 23:54:11,,Kúrā-màr̄-ḿ àw̄ gò̰ō̰ kḭ́-á jē,Mon ami est allé visiter sa mère
22/08/2022 23:54:40,,Ndī ḭ̀ gò̰y-gò̰y, Le ciel est noir de nuages
22/08/2022 23:55:11,,Bɔ̀-ḿ jē lé tō də̀w̄ gɨ́ gɔ̀jì yā̰,Mon père est un homme de petite taille
22/08/2022 23:55:36,,ā-m̄ gɔ̀l lé m-ílā dām-ḿ gɨ́,Donne-moi le gourdin afin que je le mette sur l'épaule
22/08/2022 23:56:12,,Dèné lé ìlā kùlā gɔ̀l-é dɨ́ tɔ́-á nàńg,La femme met une ficelle à sa patte et l'attache par terre
22/08/2022 23:56:33,,ḭ̀ dɔ̀ kāgɨ̄ gɨ́ òsō àr̄ gɔ̀l-é tə̀dɨ̀,Il est tombé de l'arbre et il s'est cassé la jambe
22/08/2022 23:57:01,,ɗèē dɨ̀ gɔ̀l-é,Il est venu à pied
22/08/2022 23:57:39,,M-ō dɔ̀ gɔ̀l-é ə̀ĺ,Je ne sais plus où je l'ai mis
22/08/2022 23:58:14,,Gɔ̀l màjì túngā-ī,Tu es chanceux
22/08/2022 23:58:37,,īlā ngāng gɔ̀lí,n'y retourne plus
22/08/2022 23:59:00,,gɔ̀lé này tì dáà,alors qu'il n'est pas encore arrivé
22/08/2022 23:59:22,,m̄-ɗèē Mūndūú nè àsɨ̀ gɔ̀l jōó,Je suis venu ici à Moundou à peu près deux fois
22/08/2022 23:59:46,,M-ā m-ō Njàménà gɔ̀l kárā ə̀ĺ ɓə́y,Je n'ai jamais vu N'Djaména
23/08/2022 00:00:12,,ī-gɔ́l lò dàn-á nò̰ó̰ ā-m̄,Aplanis-moi ce milieu là
23/08/2022 00:00:31,,Bɔ́rnɔ̄ jē lé dḛ́ ɗàbɨ̄ gɔ́rɔ̀ gɨ̀-lò-jē-láy,Les Bornous vendent des noix de kola partout
23/08/2022 00:00:52,,Ndɔ̄ kárā ùwà ə̄m ìlā kùlā gɔ́s-é dɨ́,Un jour il attrapa un lièvre et il attacha une corde à son cou
23/08/2022 00:01:18,,D-ódō gɔ̀y ɗèē kùndà-né kàgɨ̀ lé tɔ̄l-é., Ils apportent un pilon pour taper la panthère et la tuer
23/08/2022 00:01:44,,Gɔ̀y lé d-áw d-úr-né kō mḛ̀ bìr-í,"Le pilon, on l'utilise pour piler le mil dans le mortier"
23/08/2022 00:03:01,,ɓə̀dɨ̄ ùndā gɔ́y-é dɔ̀ kāgɨ̄ gɨ́,Le singe a posé sa fesse sur l'arbre
23/08/2022 16:06:56,,Lò tò gù,Il fait sombre
23/08/2022 16:07:20,,ìsì gù,Il reste sans rien dire
23/08/2022 16:07:51,,Yḛ̀ lé kédé kə̀m-é tō ndòō nè ɓàsí-nè tī gú,Avant il était malheureux mais maintenant il est heureux
23/08/2022 16:08:27,,Də́bɨ̄ né tà dɨ́ gúbú,Il l'a caché en renversant dessus un récipient
23/08/2022 16:08:55,,Dèné gūdúrū ná̰y mbā kàr̄ kàdɨ̄ yɔ̄lē,La femme remue la sauce pour que le sel dissolve
23/08/2022 16:09:48,,"Gūm lə̀ Njà-ḿ-gòdó ùwà də́r, kɨ́ lə̀ Sú ùwà báylà","Le piège de Njamgoto saisit une tourterelle, celui de Sou un margouillat"
23/08/2022 16:10:09,,Gūm lə̀-ḿ kīlā ùwà yèl̄, Mon piège a sauté et il a attrapé un oiseau
23/08/2022 16:10:38,,Lò tò gùmà,Il fait sombre
23/08/2022 16:10:57,,Gùmā ɗā kə́y bɔ̀r lə̀-á kàr kə́y jē gɨ́,La guêpe maçonne fait son nid de boue dans les murs des maisons
23/08/2022 16:16:06,,m̄-gúr̄ lə́m-mṵ̀ mbā gɨ̀ yēl-né pə̀r,J'ai écrasé des brins d'herbe pour en faire du feu
23/08/2022 16:16:34,, í-ɗèē gɨ̀ gúrsù wà?,Es-tu venu avec de l'argent?
23/08/2022 16:16:57,,Dèné lé gùrū ndùjī gɨ̀ màn̄ mbā tá-né bíyā,La femme mélange la farine avec de l'eau pour en faire la bouillie
23/08/2022 16:22:20,,Màm gùrū nàńg,Le python tombe brutalement à terre en se tortillant
23/08/2022 16:22:46,,Kə̀m-é tò gùsùsù,Il a les yeux bouffis
23/08/2022 16:23:08,,ɔ̀sɨ̀ hàbàg mbùdù,Il le troue d'un coup sec
23/08/2022 16:23:31,,ùwà hàdɨ̀rà,Il tire avec force
23/08/2022 16:23:59,,ùwà hàgɨ̀dà rībā,Il le rompt d'un coup
23/08/2022 16:24:19,,Tò hàmjà-hàmjà,C'est plein d'eau
23/08/2022 16:24:44,,ɔ̀sɨ̀ hàndɨ̀ ùn,Il le soulève d'un mouvement sec
23/08/2022 16:25:05,,ùwà hàŕ də̄ ɗí-á dɨ́,Il tire d'un coup sec vers lui
23/08/2022 16:25:32,,Háy! āw ɓē-é ə̀ĺ ɓí wà?,Tiens! Tu n'es pas encore rentré chez toi?
23/08/2022 16:25:52,,Háy lé tō kāgɨ̄ gɨ́ d-áw lēl-né tò,Une pagaie est une chose pour pagayer une pirogue
23/08/2022 16:26:24,,gàýlà-ə̀bɨ̀ gɨ́ háylá bè,petit tesson de pot léger
23/08/2022 16:26:41,,ùwà kūbū lì-á hà̰ẃ tīŕ,Il déchire son habit
23/08/2022 16:27:07,,ùlà hègè-hègè,Il halète
23/08/2022 16:27:30,,òrè màn̄ kūbū də̄ hə̀də̀də̀,Il presse son habit mouillé
23/08/2022 16:27:58,,Kīdō lé ə̀m̄-é ḭ̀ hə̀mə̀mə̀,La mousse de la bière s'est soulevée subitement
23/08/2022 16:28:29,,Kō lə̀-í lé ì yā̰ wə̄ĺ-nè,Ton mil a duré beaucoup cette année
23/08/2022 16:28:59,,ī-ɗā ɗí wà? (ī-rā rí wà?),Qu'est-ce que tu fais?
23/08/2022 16:29:19,, ī lé ɗā né kárā kàrà ə̀ĺ,"Toi là, tu ne fais rien"
23/08/2022 16:29:55,,ī à úlá kàr̄ ī-mā̰y ə̀ĺ,"C'est toi qui l'as dit, il ne faut pas le nier"
23/08/2022 16:30:24,,ī ná̰ wà?,Toi qui es tu? 
23/08/2022 16:30:37,,Bèrè ī-ɗèē ūndā rī-á,Demain viens lui donner un nom
23/08/2022 16:31:11,,Mbā ɗí ɓá àr̄-ī ə̀ĺ wà?,Pourquoi ne t'en a-t-il pas donné? 
23/08/2022 16:31:30,,M-ā m-ō-ī ndɔ̄ kárā ə̀ĺ,Je ne t'ai jamais vu auparavant
23/08/2022 16:33:32,,ī-tógō jī-í ār-sí j-ò̰ mùrū,Lave-toi les mains pour que nous mangions la boule
23/08/2022 16:33:55,,ḭ́yā̰-m̄ ā-m̄ m-āw sè-í,Laisse-moi partir avec toi
23/08/2022 16:34:18,,Nā̰y-kàr lé ɗèē ndáà màn̄ bā ìī,"La saison sèche est arrivée, et l'eau du fleuve a tari"
23/08/2022 16:34:41,,Kàr ìbì lò yā̰,Il y a une bouffée d'air chaud
23/08/2022 16:34:59,,Ngōn ìbì pə̀r kùdù bàrádɨ̀ lə̀ bɔ̀b-é jē,L'enfant active le feu sous la théière pour son père
23/08/2022 16:35:30,,Ndáà ìlā kìyā lé àr̄-é ìgì,Alors il laisse le couteau tomber de sorte qu'il
23/08/2022 16:35:51,,ìgì-m̄ sél,Ça m'a échappé (je l'ai oublié).
23/08/2022 16:36:16,,Ndī ìl̄ àr̄ lò ndùl,Il fait sombre et nuageux
23/08/2022 16:36:41,,ìlā-á gɨ̀ mḭ̀yā̰ lì-á tɔ̄l-é,Il lance le couteau de jet sur lui et le tue
23/08/2022 16:37:01,,Ngōn lé lá mángò gɨ́ m-īlā m-ār-é lé ùwà,Le garçon a attrapé la mangue que je lui ai jetée
23/08/2022 16:37:21,,ùn tūwā ɗèē ìlā ɗágá tò dɨ́,"Elle prend une natte, l'étend dehors et se couche dessus"
23/08/2022 16:37:46,,M-īlā né lə̀-ḿ kárā kɔ̄rɔ́,J'ai perdu quelque chose
23/08/2022 16:38:23,, ìlā ɓèlè,jouer au jeu de hasard
23/08/2022 16:38:47,,ìlā dɨ́,répondre à question
23/08/2022 16:39:14,,ìlā də̄ tàsí dɨ́ nè,rôder autour de nous
23/08/2022 16:39:41,,ìlā dì-á dɨ́,il l'a incité contre lui
23/08/2022 16:40:08,,ìlā kə̀m kūbū gɨ́ lə̄w gɨ̀ è gɨ́ sìgì,Il a rapiécé le vieux habit avec le neuf
23/08/2022 16:40:54,,ìlā màn̄ lé ndásɨ́ ,boire d'un trait toute l'eau
23/08/2022 16:41:42,,ìlā rɔ̄-kūl dì-á dɨ́,s'attirer la honte sur soi-même
23/08/2022 16:42:15,,Njè-ɓògò lé ndìgì kìlā mbàng tà gɨ́ ə̀ĺ,Le voleur ne voulait pas répondre au chef
23/08/2022 16:42:37,,ìm̄ rī-á dɔ̀-dé gɨ́,Elle a été de mauvaise humeur avec eux
23/08/2022 16:42:59,,M-īm rɔ̄-ḿ dɔ̀ né ɗī-á gɨ́,Je m'ennuie sur les choses qu'il fait
23/08/2022 16:43:16,,Dèné lé ndīr ná̰y ímā mbā kàr̄ ngàb-é jē,La femme préparait une sauce de gombo pour son mari
23/08/2022 16:43:38,,àw̄ ìngà də̀w̄ sì ùr būwá-màn̄,Il est allé et il a trouvé un homme qui était en train de creuser un puits
23/08/2022 16:44:05,,M-íngā bɔ̀b-í jē ɗə́bə́,J'ai rencontré ton père sur le chemin
23/08/2022 16:44:25,,íngā mbā jē wà?,As-tu reçu des hôtes?
23/08/2022 16:44:44,,D-íngā né kùsà-dé ə̀ĺ,Ils n'ont pas de quoi manger
23/08/2022 16:45:08,,Mbī kāgɨ̄ nè lé rḛ̄ ìngà dɔ̀-ḿ gɨ́,Les feuilles de cet arbre se collaient à mes cheveux
23/08/2022 16:45:33,,íngā lé tō né də̀w̄ ndìsā-né mbāý tà,Le rasoir est une chose pour raser les barbes
23/08/2022 16:45:56,,īnjī pə̀r lé ā-m̄,Allume le feu pour moi
23/08/2022 16:46:23,, Ngōn ìnjī pə̀r mbā ró-né mṵ̀,L'enfant a allumé le feu pour brûler les herbes
23/08/2022 16:46:51,,M-āw m-ɔ́sɨ̄ bìrī-í m-ār-é ìrī,Je vais les écraser dans le mortier pour qu'ils se réduisent en farine
23/08/2022 16:47:14,,M-ā kò̰ írī gɨ̀ mùrū,Je mangerai l'oseille avec la boule
23/08/2022 16:47:35,,Ná̰y lé ndīr gɨ̀ kàndɨ̄ írī ndà,On fait cette sauce avec le fruit de l'oseille blanc
23/08/2022 16:48:04,,ī-ɗèē ísī nàńg mḛ̀ tūwā dɨ́ nè,"Viens ici, assieds-toi sur la natte"
23/08/2022 16:48:31,,ísī jē ī-ngínā-m̄ jē lám,Assieds-toi ici et attends-moi un instant
