Timestamp,Email address,sba,fr
27/08/2022 00:57:02,,Kébē jē mbó̰ dɔ̀ nà̰ā̰ tà bùlà màn̄ gɨ́,Les papillons se rassemblent à côté du puits
27/08/2022 00:57:21,,"Yégɨ̄ jē gɨ́ bùlà kə́y lə̀-ḿ kédé lé, bàtú tɔ̄l-dé láy","Les rats qui abondaient dans la maison avant, le chat les a tous mangés"
27/08/2022 00:57:40,,ùn kùlā tɔ́ njà dɨ́ kédé,Il prend une corde et il attache les pattes de devant avec
27/08/2022 00:58:07,,Kàmyō̰ gɨ́ à-ń lé ḛ̀ yàá à tèē kédé,"Ce camion qui reste là, c'est lui qui sortira le premier"
27/08/2022 00:58:33,,"úr nàńg ngàā, m-ā kàw̄ kédé","Descends maintenant, je vais poursuivre ma route"
27/08/2022 00:58:58,,J-àw̄ ndōgō kānjī kédé-gàlá ɓōgɨ́-nè,Allons acheter du poisson au petit marché aujourd'hui
27/08/2022 12:49:59,,"Lò gɨ́ āw sì-á ndò̰ gɨ́ ndáā, úw-á jī-í gɨ́ kég","Quand tu l'amènes à la chasse, prends-le avec ta main fortement"
27/08/2022 12:50:17,,Kèĺ ɗá dɨ́?,De quel côté?
27/08/2022 12:50:37,,"Ndɔ̄ kárā àw̄ ndò̰, tèē dɔ̀ dùl gɨ́ àw̄ gɨ̀ kèm",Un jour il va à la chasse et rencontre une biche-cochon qui était pleine
27/08/2022 12:51:03,,Kùnà àw̄ èsɨ̀ kèm ngàā,Le sorgho a déjà formé des épis
27/08/2022 12:51:37,,lò gɨ́ āw ndòlè kèné-kèné lə̄w lə̄w lé,là où tu as l'habitude d'en chercher depuis longtemps déjà
27/08/2022 12:52:01,,Kə́y nè ɓá m̄-tò kènéng gɨ́,C'est dans cette maison où j'habite
27/08/2022 12:52:29,,Mḛ̀ ɓɔ́l nè ɓá m̄-ílā làr lə̀-ḿ kènéng,C'est dans ce sac où j'ai mis mon argent
27/08/2022 12:52:50,,Kèrè lé tō yèl̄ gɨ́ tá nà̰ā̰ gɨ̀ tànjì bè nè ḛ̀ tōgɨ́ sḛ́ bà lə́m bèl̄-é ndàng lə́m tɔ̀,La perdrix est un oiseau pareil à la pintade mais elle est plus petite et ses plumes sont rayées
27/08/2022 12:53:09,,M-ílā kéré kɔ̄rɔ́,J'ai perdu une clef
27/08/2022 12:53:27,,Kér̀mēé jē bùlà dàrā ɓōgɨ́-nè,Il y beaucoup d'étoiles dans le ciel aujourd'hui
27/08/2022 12:53:47,,Ngōn lé késɨ̄ yā̰ dá d-ár-é kàdɨ̄-ngàmbáy kàr̄-é ò̰,L'enfant toussait beaucoup alors on lui a donné du sel indigène pour sucer
27/08/2022 12:54:07,,Ngōn lé àw̄ kḛ̄rḛ̄ kə̀m-é gɨ̀-mbā kòō-né màr̄-é jē,L'enfant regard tout autour pour voir ses copains
27/08/2022 12:54:31,,Ndī à kə̀r ndáà m-ā kə́ tūwā kìlā kə́y,"Il va pleuvoir, alors je vais enrouler la natte et la mettre dans la maison"
27/08/2022 12:54:53,,Dìngàm lé kə̄bɨ̄ jī-á ɓār-né dèné jē,L'homme a fait des signes avec la main pour appeler les femmes
27/08/2022 12:55:27,,Tɔ̀gɨ̀ nè lé kə̀mə̄ lì-á kə́dɨ́rə́ yā̰,La respiration est devenue très difficile pour ce vieux là
27/08/2022 12:55:47,,Kāgɨ̄ kāgɨ̄ nè lé kə́dɨ́rə́ yā̰,Le bois de cet arbre est très dur
27/08/2022 12:56:18,,Ngōn lé ɓə̄ĺ ndáà kə̄l gē-é,L'enfant avait peur et il a regardé derrière lui
27/08/2022 12:56:36,,m̄-tógō kūbū lə̀-ḿ m-ār-ē ndà kə́lú-kə́lú,J'ai lavé mon habit ainsi qu'il est très blanc
27/08/2022 12:57:23,,"ngàlì gɨ́ kə̀m, bāngàw gɨ́ kə̀m, mìnjì gɨ́ kə̀m ","manioc cru, patate douce crue, haricot cru"
27/08/2022 12:57:49,,Də̀w̄ gɨ́ tɔ̀gɨ̀ də̀jì né dɨ̀ kə̀m-é,Le vieillard quémande avec ses yeux
27/08/2022 12:58:10,,Ngō-màr̄-é ùndà kə̀m-é àr̄ kə̀m-é tí,"Son ami l'a tapé dans l'oeil, et son oeil est gonflé"
27/08/2022 12:58:43,,kə̀m-ḿ dɨ́,en ma présence
27/08/2022 12:59:12,,tā kə̀m kōò sé kə̀m làr wà?,L'as-tu pris pour payer avec du mil ou avec de l'argent? 
27/08/2022 12:59:42,,ìsì-né dɨ̀ kə̀m-é yàá ɓí,quand il était encore vivant
27/08/2022 13:00:01,,dā gɨ́ kə̀m,viande crue
27/08/2022 13:00:18,,tàr gɨ́ kə̀m ,parole grossière
27/08/2022 13:00:36,,Tō né gɨ́ kə̀m ndàm-né èĺ,C'est une chose qu'on ne doit pas jouer avec
27/08/2022 13:01:07,,m̄-ndìgì tā kə̀m̄,Je veux me reposer
27/08/2022 13:01:35,,òō ngōn gɨ́ ùwà kə̄m-kāgɨ̄ àl̄ tàŕ lé ə̀ĺ,Il n'a pas vu que l'enfant avait attrapé une branche d'arbre et y était grimpé
27/08/2022 13:01:57,,ùwà bèl̄ lé mbā tɔ̄bɨ̄-né kə́m jē dɔ̀ ngōn dɨ́,Elle prit l'éventail pour en chasser les mouches sur son fils
27/08/2022 13:02:18,,Kə́m jē jɔ̄gɨ̄ né yā̰,Les mouches dérangent beaucoup
27/08/2022 13:02:49,,ɓèdɨ̄ lé sì kə́m kāgɨ̄ gɨ́ tàŕ. si,Le singe s'est assis en haut dans la branche de l'arbre
27/08/2022 13:03:15,,Né sì-á gòdó àr̄ kə̀m-ndòō ɗī-ā yā̰,Il n'a rien à manger et il est très malheureux
27/08/2022 13:03:35,,ī-ɗā bàń ɓá úwā kə̀m-ndō̰y gɨ́ bə̀ý ə̀ĺ wà?,Comment se fait-il que tu n'aies pas pris un gros capitaine
27/08/2022 13:03:57,,Tɔ̀gɨ̀ nè lé kə̀mə̄ lì-á kə́dɨ́rə́ yā̰,La respiration est devenue très difficile pour ce vieux là
27/08/2022 13:04:18,,Mā̰ m̄-ndìgì kə̀n̄ kūbū lə̀-ḿ màn̄ mḛ̀ sóò gɨ́,Je vais tremper mes vêtements dans le seau
27/08/2022 13:04:39,,"Ngōn tò ɓī yā̰, kə̀n̄ yā̰",L'enfant dormait fort et il ronflait beaucoup
27/08/2022 13:05:01,,àw̄ yàá kə̀ń,Il est sans doute parti
27/08/2022 13:05:20,,"àw̄ òdō sīngā, ɗèē ndīr-nè òm ùbū kə̀nə̀ngɨ́ ə̀ĺ","Elle rassembla des os, les fit cuire, mail elle ne verse pas d'huile dedans"
27/08/2022 13:05:46,,Lò-gɨ́ ḛ̀ òō bɔ̀b-é ndáà ə̀w̄ pà tà kə́ng,Quand il a vu son père il a cessé de parler net
27/08/2022 13:06:06,,ɔ̀r̄ kə̀m kə́ngɨ́ng,C'est un peu dégagé
27/08/2022 13:06:25,,Lò tō kə̀njī,L'endroit est dégoûtant
27/08/2022 13:06:45,,Kə̀r̄ lé tō dā gɨ́ bòý yā̰ ùndā màr̄-é jē,L'éléphant est un animal qui est beaucoup plus grands que les autres
27/08/2022 13:07:55,,ɓōlé lī tó̰-í ndáà də̀w̄ à kə̀r̄-ī gɨ̀ kùlā ə̀ĺ,"Si un serpent t'a mordu, on ne te trompe pas avec la corde"
27/08/2022 13:08:18,,Kó̰ ngōn nè lé dàw yā̰ nè kə̀r̄ ḭ̀ tàá yàá,La mère de cet enfant est très fatiguée mais elle essaie de se lever quand même
27/08/2022 13:08:39,,m̄-kə̄ŕ ùbū nò̰ó̰ lé m-ūndā dɔ̀ pə̀r dɨ́ m-ār-é lḛ̀ḛ̄,Je récure l'huile et je l'ai mis sur le feu pour qu'elle fonde
27/08/2022 13:08:58,,M-ā kùsà tə̰̄y gɨ́ pə́lə̄ gɨ̀ kə́r,Je mangerai bien du petit mil mélangé au sésame
27/08/2022 13:09:21,,Kə́r ɓá d-ɔ́sɨ̄-né kàndà,"On utilise le sésame pour préparer la sauce appelée ""kanda"""
27/08/2022 13:09:45,,Ngōn nè lé à kə̀r-gōsɨ̄ yā̰ léè,"Cet enfant là va être très rusé, hein!"
27/08/2022 13:10:13,,Dìngàm gɨ́ bàń ɓá kə̀sɨ̄ bè wà?,Comment un homme peut être si avare?
27/08/2022 13:10:49,,Wúl lé kə̄sɨ̄ ə̀ĺ yàá ɓə́y nè ngán jē tɔ́r̄,Les arachides ne sont pas encore mûres mais les enfants les ont déterrées
27/08/2022 13:11:13,,Kə́w lé tō yèl̄ gɨ́ gɔ̀l-é ngāl yā̰ lə́m bèl̄-é ndà kə́lú-kə́lú lə́m tɔ̀.,Le héron garde-boeufs est un oiseau à longues pattes et avec des plumes d'une blancheur éblouissante
27/08/2022 13:11:34,,Dɨ̀ ndɔ̄ɔ́ lé m-āw m-ō kə́y gɨ́ ngō-kó̰-ḿ ɗā,Le matin je suis allé voir la maison que construit mon frère
27/08/2022 13:11:58,,Gùmā ɗā kə́y lə̀-á kàr kə́y jē gɨ́,La guêpe maçonne fait son nid dans les murs des maisons
27/08/2022 13:12:32,,kə́y bɔ̀m,case entièrement en paille
27/08/2022 13:12:59,,ḛ̀ ùwà kānjī jē gɨ̀ kìī,Il pêche les poissons avec l'hameçon
27/08/2022 13:13:23,,ɓōgɨ́-nè dá kīdō ɔ̀dɨ̀ tà-ḿ ə̀ĺ yàá ɓí,"Aujourd'hui, vrai, la bière n'a pas encore touché ma bouche"
27/08/2022 13:13:54,, āw ún kīdō lé ɗèē né ā-m̄,"Va prendre de la bière de mil, donne en moi"
27/08/2022 13:14:19,,àr̄-m̄ kìníǹ tɔ̀ ɔ̀sɨ̀-m̄ tɔ̀,Il m'a donné de la quinine et m'a fait une piqûre
27/08/2022 13:14:41,,"ɓōlé ī-gòdó ndáà, m-ā kìngà kéré lə̀-ḿ ə̀ĺ yàá sár","Si tu n'avais pas été là, je n'aurais jamais trouvé ma clef"
27/08/2022 13:15:05,,Pà nà n-à ɗā bàń ɓá n-à kìngà-né bísī lə̀ mbàw nè lé wà?,Il se demandait ce qu'il pourrait bien faire pour trouver le chien de ce pêcheur
27/08/2022 13:15:39,,Kédé lé dèné jē d-ó̰ kīnjá ə̀ĺ,Auparavant les femmes ne mangeaient pas de poulet
27/08/2022 13:15:58,,Kó̰ ngán jē lé tā kīr ùndà dɔ̀ ngōn-é dɨ́ gɨ́ dìngàm,La mère des enfants prend le fagot et le pose sur la tête de son fils
27/08/2022 13:16:21,,Kó̰ ngán jē lé tā kīr ùndà dɔ̀ ngōn-é gɨ́ gɨ́ dìngàm,La mère des enfants prend le fagot et le pose sur la tête de son fils
27/08/2022 13:16:53,,M-ā kìsì rɔ̄ kó̰-ḿ dɨ́,Je vais rester près de ma mère
27/08/2022 13:17:49,,ā kàw̄ kìsì ɗā ɗí wà?,Que vas-tu faire pendant ce temps?
27/08/2022 13:18:08,,D-úwā bḭ̄yā̰ gɨ̀ d-ún kìyā d-ár-dé,Ils leur donnent un cabri et un couteau
27/08/2022 13:18:34,,Kìyā lé d-ínjā-né dā,"Le couteau, on l'utilise pour couper la viande"
27/08/2022 13:18:57,,Kḭ̀-ḿ ɗə́bə́ yàá ɓí m-ár nè,Je viens d'arriver tout de suite
27/08/2022 13:19:33,,Lò-gɨ́ m-āw ndáà lé métə̀r à kḭ̀ sə̀-ḿ ɓá m̄-ɓə̄ĺ-né,"Si j'y vais, le maître va me gronder, c'est pourquoi j'ai peur"
27/08/2022 13:19:52,,Kúrā-màr̄-ḿ àw̄ òō kḭ́-á jē, Mon ami est allé visiter sa mère
27/08/2022 13:20:09,,Tō kɨ́ lə̀-ḿ,C'est le mien
27/08/2022 13:20:30,,Ndɔ̀ɔ̄ ndɔ̀ɔ̄ kò jōó,Il a labouré deux parcelles
27/08/2022 13:20:47,,m̄-mbə́r̄ kándɨ̄ kō gɨ́ màjì mbā dùbū,J'ai choisi les meilleures semences pour semer
27/08/2022 13:21:13,,Kàr kìnjà kō lé nà̰y ɓə́y,Il n'est pas encore le temps pour la récolte du mil
27/08/2022 13:21:38,,Kō wúl gɨ́ nè dá màjì yā̰,Cette variété d'arachide est très bonne
27/08/2022 13:22:03,,M-ō kō-í,J'ai entendu parler de nouvelles de toi
27/08/2022 13:22:30,,Ndáà bèrè yàá ɓá j-à kòō nà̰ā̰ ɓə́y tā,Ainsi demain nous nous reverrons donc
27/08/2022 13:22:49,,Bèrè ɓá m-ā kàw̄ kèē-é ɓí,Demain j'irai le voir
27/08/2022 13:23:16,,Kòbɨ̀ lé tō kāgɨ̄ gɨ́ kànd-é kàsɨ̀ ndáà lèl̄ yā̰,"Le ""kobi"" est un arbre que si son fruit est mûr il est très délicieux"
27/08/2022 13:23:35,,ìlā dàm-á ìlā kóbō tì-á dɨ́,Il le dépose dans le grenier à mil et met un couvercle par dessus
27/08/2022 13:23:59,,Ngán jē gɨ́ d-ó sú lə̀ bɔ̀-dé jē lé kógō yā̰,Les enfants qui écoutaient le conte de leur père riaient beaucoup
27/08/2022 13:24:17,,Ngāng gɨ́ kògō à tél ngāng gɨ́ nō̰,Dents qui sourient deviendront dents que pleurent
27/08/2022 13:24:34,,M-ā kòjī ndògō kìlā gìr kə́y lə̀-ḿ,Je vais tresser du secko pour entourer ma maison
27/08/2022 13:24:54,,Yḛ̀ ùndà kòndè màjì yā̰,Il joue la cithare très bien
27/08/2022 13:25:14,,Də̀w̄ jē pà nà Mbōrōrō jē lé ɗā ndò̰-kóndɨ́ró lə̀-dé gɨ̀ kùmā,Les gens disent que les Mbororo préparent la pointe de leurs flèches avec du poison
27/08/2022 13:26:02,,àw̄-né tɔ̀ӯ sə̀-á mbùnā kāgɨ̄ dɨ́ dɔ̀ kóngō-màn̄ dɨ́,Il est parti avec lui parmi les arbres au long de la falaise
27/08/2022 13:26:21,,Lél ùlà yā̰ àr̄ kòr̄ ùdū lò réd-réd,Le vent a soufflé beaucoup et la poussière ne permet même pas de voir
27/08/2022 13:26:41,,Ngōn bísī lé àā dɨ̀ kàw̄ sə̀-dé; njé-tɔ̀gɨ̀ jē kór̄-é,Le petit chien allait partir avec eux; les grands le chassent
27/08/2022 13:27:07,,"Njè kòrè gō-é lé ùndā rī-á nà ""Njā-ùsà-kàr-dàm-dɨ́""","Celui qui suive, il le nomma ""Le renard mange à côté du grenier"""
27/08/2022 13:27:36,,Dèné àr kōrē árgè,"La femme remue la boule pour le ""argi"" "
27/08/2022 13:27:55,,Kòrō lé òdō né yā̰ ùndā kúndā,Un âne peut porter plus qu'un cheval
27/08/2022 13:28:19,,ùndā màn̄ pə̀r-ə́ mbā kōrō-né mùrū,Elle fait bouillir l'eau pour préparer la boule de mil
27/08/2022 13:28:50,,Kórō báylà gɨ́ àw̄ túrū kō,Chasse le margouillat qui avale la céréale
27/08/2022 13:29:05,,Kúrā-màr̄-é lé ə̀njī pà nà àw̄ kórō-nè mbā tɔ̄l-nè,Son ami pense qu'il le chasse pour le tuer
27/08/2022 13:29:23,,Kòsɨ́ lé àr̄-ī ə́r ə̀dɨ̄ yā̰,Les concombres te font uriner beaucoup
27/08/2022 13:29:39,,ī-ɗèē jì-ɗɔ̄ kósɨ̀,Viens jouer aux cartes avec moi
27/08/2022 13:30:16,,Sé tō kósɨ̀ ɗí wà?,L'atout est quoi?
27/08/2022 13:30:33,,Kòy lə̀ ngōn lé tō yā̰ ùndā kòy lə̀ də̀w̄ gɨ́ tɔ̀gɨ̀,La mort d'un petit enfant fait plus mal que la mort d'un adulte
27/08/2022 13:31:23,,M-ā kìsì rɔ̄ kó̰-ḿ dɨ́ yàá lám mbā-tà m-ō-é ə̀ĺ yàá lēw bàá,"Je vais rester un peu près de ma mère, parce que je ne l'ai pas vue depuis longtemps"
27/08/2022 13:31:39,,Kó̰-í jē gòdó ndáà nàm gɨ̀ kà-í jē,"Si tu n'as pas de mère, tu vivras avec ta grand-mère "
27/08/2022 13:32:04,,Tō də̄ kó̰-nān-ḿ gɨ́ dèné,C'est ma soeur
27/08/2022 13:32:39,,Kāgɨ̄ làl̄ jī ɓə̀dɨ̄ ndáā tò kɔ̀bɨ̀,"Si le singe rate la branche d'un arbre, c'est incroyable"
27/08/2022 13:33:01,,Kàr lé jɔ̄gɨ̄-m̄ yā̰ ndáà m-ā kɔ̀dɨ̀ kàw̄ ndíl-í,"Le soleil me dérange beaucoup, alors je vais bouger à l'ombre"
27/08/2022 13:33:23,,Nò̰ kɔ̀g-ɔ́,au seuil de la concession
27/08/2022 13:33:55,,M-ā kɔ̀j-ī né jē yā̰ ɓí ,"Sois patiente, je vais te montrer encore beaucoup de choses "
27/08/2022 13:34:06,, M-ā kɔ̀j-ī né jē yā̰ ɓə́y,"Sois patiente, je vais te montrer encore beaucoup de choses "
27/08/2022 13:34:23,, Kɔ̄jī ngōn lé bòý yā̰,Les joues de ce petit enfant sont très grosses
27/08/2022 13:34:37,,Ndī ə̀r kɔ̄jī, Il pleut de grêle
27/08/2022 13:34:53,,Kɔ́jɔ̀l lé tō né kùndā gɨ́ àw̄ gɨ̀ kə́y lə̀-á gìr-é gɨ́,L'escargot est une créature qui se promène avec sa case sur le dos
27/08/2022 13:35:11,,M-ā m-ó̰ mùrū gɨ̀ jī kɔ̀l-ḿ,Je mange la boule avec la main droite
27/08/2022 13:35:28,,Ngán jē kɔ̄l nà̰ā̰ dɔ̀ mùrū gɨ́,Les enfants se querellent sur la boule
27/08/2022 13:35:54,,Njè-ndɔ̀ɔ̄ lé ndɔ̀ɔ̄ sár-sə̀nà kɔ̀r ùn-é,Le cultivateur a travaillé si fort que la fatigue enfin s'empara de lui
27/08/2022 13:36:17,,Kɔ̄r ɗā-m̄ yā̰ yàá tɔ́g-ḿ gɨ́ kàr̄ m-ūsū-né nàńg gòdó,Je suis très fatigué et je n'ai plus de force pour le descendre par terre
07/09/2022 01:01:29,,də̀w̄ kùjì,une personne libre
07/09/2022 01:01:56,,Kūl tínā lé yɔ́gɨ̄,Le manche de la hache a de jeu
07/09/2022 01:02:27,,Màn̄ kūl lé kūl kàr-ḿ yùdùdù,L'eau fraîche m'a rafraîchi beaucoup.
07/09/2022 01:02:49,,M-ār-é ndùl ngà-ɓá m-ūsū m-ūndā nàńg m-ār-é kūl,"Je les laisse noircir, alors je les pose sur la terre pour qu'elles refroidissent"
07/09/2022 01:03:10,,Màr lé tō kāgɨ̄ gɨ́ ngāl ndáà kánd-é kūl yúrúrú,Le rônier est un arbre haut et droit avec un fruit qui est très doux
07/09/2022 01:03:38,,ɓōgɨ́-nè lé kūl ò̰-sí yā̰,Aujourd'hui le froid nous dérange terriblement
07/09/2022 01:04:01,,ùndā kūl ,garder un reste
07/09/2022 01:04:25,,Dèné lé kúl gə́m gɨ̀ mbā-tà lə̀ mbā jē,La femme préparait la sauce longue pour les invités
07/09/2022 01:04:50,,Kùlà gɨ́ kīdō ɗā dɨ̀ bɔ̀b-í jē lé! ,Un beau travail que la boisson a fait avec ton père!
07/09/2022 01:05:22,,m̄-tɔ̄l tà kùlà lə̀-ḿ ɓàsí-nè ngàā,J'ai fini mon travail maintenant
07/09/2022 01:05:41,,D-úlā-m̄ də̄ kùlà,On m'a chargé d'une commission
07/09/2022 01:06:20,,ùn kùlā tɔ̄-né gɔ̀l-é gɨ́ kédé gɨ̀ gɔ̀l-é gɨ́ gògó,Il prend une corde et il attache les pattes de devant et celles de derrières
07/09/2022 01:06:41,,M-ínjā kùlā m̄-gāng gɨ̀ kìyā,J'ai coupé la corde avec un couteau.N demi-hectare
07/09/2022 01:07:03,,Kúlū lé tùdù ə̀ĺ ùn pə̀r kànàng ə̀ĺ,"Le charbon n'est pas du tout sec, il ne prend pas feu vite"
07/09/2022 01:07:21,,Kúlūlū gɨ́ bòý lé àӯ mə́sɨ̄ də̀w̄ jē,Les mille-pattes grands sucent le sang des gens
07/09/2022 01:07:40,,Kūm ngōn-ḿ ndùm ndáā òsō,Le nombril de mon enfant est pourri et il est tombé
07/09/2022 01:08:22,,ndɔ̀ɔ̄ ndɔ̀ kùmā nà̰ā̰,cultiver en association (à tour de rôle dans le champ de l'autre)
07/09/2022 01:08:50,,àr̄-m kùmā kárā bè,Il m'a donné un médicament
07/09/2022 01:09:11,,"Kùmā gɨ́ d-á-m̄ lé màjì yā̰, rɔ̄-ḿ tō màjì ngàā","Le médicament qu'on m'a donné était bon, je suis mieux maintenant"
07/09/2022 01:09:33,,Kùmā lé ɓá d-áw d-ájí-né də̀w̄ jē,Les médicaments sont ce qu'on utilise pour guérir les maladies
07/09/2022 01:09:54,,Bèrè kàr kùmàtàgɨ́,Demain dans l'après-midi
07/09/2022 01:10:17,,ún bìrī dáà ā kùn gɔ̀y,"Quand tu prends le mortier, tu va prendre le pilon"
07/09/2022 01:10:42,,Kūn gɨ́ ùbà gɨ̀ kō nàńg lé ùd-é kə̀m̄,Les épines poussent avec le mil et l'étouffent
07/09/2022 01:11:39,, Kə̀r̄ òō bòlò kùd-é ɓá ùsà kūn-pɔ̀rɔ̀rɔ̀ ɓí,L'éléphant voit son grand anus d'abord il mange des grand épines (de l'arbre Acacia sieberiana)
07/09/2022 01:12:08,,Də̀w̄ jē d-ísɔ̄ póy mbā tɔ̄l-né kùndā,"Les gens mangent le tubercule ""poy"" pour arrêter la soif"
07/09/2022 01:12:30,,m̄-kūndā ngɔ́y gìr-é m̄-tɔ̄r m-ɔ́m kɔ̄rɔ́ ngàā m-ḭ́yā̰ kánd-é,"Je frappe leur pulpe et je l'enlève et le jette, et je laisse son fruit (l'amende de karité)"
07/09/2022 01:12:50,,Bɔ̀ɔ̄-ḿ jē ndōgō kúndā gɨ̀-mbā ngə̄m-né màn̄g jē lə̀-á,Mon père a acheté un cheval pour garder ses boeufs
07/09/2022 15:44:22,,ùn kúndū ɔ̀sɨ̀-né pā,Il prit le balafon et chante une chanson
07/09/2022 15:44:42,,Kúndū ɓār ùndā kòndè,Le balafon résonne plus que la cithare
07/09/2022 15:45:05,,Kūnjá lə̀-í nè lé làr-é kándɨ́ wà?,"Ta poule là, son prix est combien?"
07/09/2022 15:45:26,,Kédé lé dèné jē d-ó̰ kūnjá ə̀ĺ,Auparavant les femmes ne mangeaient pas de poulet
07/09/2022 15:45:52,,Mṵ̀ dɔ̀ jōó ɓá àsɨ̀-né kùnjī,Deux bottes d'herbes d'abord suffisent pour tresser
07/09/2022 15:46:14,,Ngōn mbādɨ́ kùr nàńg,L'enfant refuse de descendre
07/09/2022 15:46:38,,Kùr-í ə̀w yā̰,Tu as tardé 
07/09/2022 15:47:06,,ɓá kùr-é ə̀w yā̰ lə́m,Sa durée est très longue aussi.
07/09/2022 15:47:44,,Tìl nè lé kùr̄ jē jɔ̄gɨ̄ yā̰,Cette nuit les petits insectes me dérangeaient beaucoup
07/09/2022 15:48:05,,ḛ̀ ò̰ kùr̄ jē lə́m ngán yèl̄ jē gɨ́ ɗàng lə́m tɔ̀,Il mange des petits insectes et des autres petits oiseaux
07/09/2022 15:48:26,,Rɔ̄ kānjī kūŕ lé à̰ӯ gə́m tōgɨ́ gə́m bè,"Le corps du poisson ""kur"" est visqueux comme la sauce longue"
07/09/2022 15:49:09,,Kūŕ-ngāng tī-á yā̰ àr̄-é tò ɓī tìl ə̀ĺ,La carie dentaire le faisait mal de sorte qu'il ne pouvait pas dormir la nuit
07/09/2022 15:50:48,,Púdū kūrā lé ndīr-nè ná̰y,"La fleur du kapokier, on l'utilise dans les sauces"
07/09/2022 15:51:18,,Dḛ́ ngán bàsá jē nè lé tō kúrā màr̄ nà̰ā̰ jē,Ces jeunes garçons sont des amis
07/09/2022 15:51:43,,ɔ̀r̄ kúrā də̀,tenir compagnie
07/09/2022 15:52:05,,J-à kàw̄ kòō kúrā-màr-sí jē,Nous allons visiter nos amis
07/09/2022 15:52:26,,M-íngā kúrā-màr̄-ḿ kárā yàá,J'ai rencontré un copain en chemin
07/09/2022 15:53:00,,Kúrā-màr̄-ḿ ə̀r̄-m̄ gɨ̀ làr,Mon copain m'a trompé avec l'argent
07/09/2022 15:53:25,,Ngōn-ḿ àw̄ kùndà bál̀ gɨ̀ kúrā-màr̄-é jē,Mon fils est parti jouer au football avec ses copains
07/09/2022 15:53:49,,Kúrā-màr̄ màjì ùndā nòjī,Les relations d'amitié sont mieux que celles de famille
07/09/2022 15:54:21,,Tō kùrū gɨ́ tò nè,C'est cet insecte-là
07/09/2022 15:54:39,,"ūndā-jē mbī-sí màjì ō-ī-jē-né tàr lé, là tà-ḿ tùdù kúrúm kúrúm","Prêtez bien l'oreille et écoutez, car j'ai la bouche très sèche"
07/09/2022 15:54:58,,"ɓō ɗā-dé yā̰, d-íngā né kùsà ə̀ĺ","C'est la famine, ils n'ont plus de quoi manger."
07/09/2022 17:26:43,,"Būrā lə̀-ḿ sḛ́ yā̰ ɓō, à kùwà kānjī gɨ́ bə̀ý ə̀ĺ",Mon filet est trop petit pour prendre un grand poisson
07/09/2022 17:27:07,,M-āw lò kùwà kānjī dɨ́,Je suis allé à la pêche
07/09/2022 17:27:34,,M-ā kùwà rɔ̄-ḿ lám,Je vais me reposer un peu
07/09/2022 17:27:53,,Nā̰y à kùy ɓá,A la fin du mois
07/09/2022 17:28:14,,"Kúy, né lé tò nè yàá wà!","Ah bon, la chose est là!"
07/09/2022 17:28:35,,Kṵ́nā̰ lə̀-í lé nō̰ tìl nè sár ɔ̀gɨ̄-m̄ lò tò ɓī,"Ton coq a chanté toute la nuit, il m'empêche de dormir!"
07/09/2022 17:29:05,,ún ɓá là mə̀-í à kùy ,Prends-le car tu risques de l'oublier
07/09/2022 17:29:28,,ún ɓá nà mə̀-í à kùy,Prends-le car tu risques de l'oublier
07/09/2022 17:29:49,,"Màjì, ī-tā là","Bien, prends-le donc"
07/09/2022 17:30:08,,āw tā-né kīdō ā-m̄ m̄-āy là,Va donc prendre la bière de mil pour moi
07/09/2022 17:30:31,,ī-tā bíkɨ̀ nè sé à lá sə̀-í wà?,"Prends ce bic, est-ce que ça peut t'aider?"
07/09/2022 17:31:04,,Másàr lé ùy yò lá,Le maïs a perdu sa saveur 
07/09/2022 17:31:27,,Báylà làbɨ̄ rī-á kàr kāgɨ̄ gɨ́,Le margouillat s'est attaché au côté de l'arbre
07/09/2022 17:31:50,,āw làbɨ̀dāǹ dɨ́ ngàā à?,Es-tu déjà allé à l'hôpital?
07/09/2022 17:32:14,,Sé āw làbɨ̀dāǹ gɨ́ ngàā wà?,Es-tu déjà allé à l'hôpital?
07/09/2022 17:32:37,,M-ɔ́r̄ rɔ̄ lágɨ́-làā ndáà jī-ḿ tí,J'ai touché une chenille et maintenant j'ai la main enflée
07/09/2022 17:33:01,,Tò ndíìjē sé láàjē wà?,Es-tu une fille? 
07/09/2022 17:33:25,,ɗí ɓá ī-tél-né ɗə́w làkɔ́l̀ dɨ́ wà? ,Que se passe-t-il pour que tu reviennes sur la route de l'école?
07/09/2022 17:33:48,,"Tōgɨ́ kó̰-sí làl̄ kàӯ kīdō lé, àw̄ lò-kàӯ-kīdō gɨ́ ɓò","Comme votre mère ne manque jamais de boire de la bière, elle est partie au cabaret donc"
07/09/2022 17:34:06,,ùr-m̄ làl̄-m̄,Il m'a raté
07/09/2022 17:34:24,,m̄-ndìgì kùwà ngōn lé nè m-úr-é m̄-làl̄-é,J'ai essayé d'attraper l'enfant mais je l'ai raté
07/09/2022 17:34:47,,Bḭ́ gɨ́ ndɔ̀ɔ̄ làl̄ kàdɨ̄-síngā lé àndɨ̄ màjə̀ĺ,Le coton cultivé sans l'engrais ne produit pas bien
07/09/2022 17:35:23,,Bè ndáà ɗèē gɨ̀ ngàlì lám,Alors rapporte un peu de manioc
07/09/2022 17:35:48,,m̄-gə̀r̄ lám lám,Je sais un tout petit peu
07/09/2022 17:36:13,,Kàndɨ̄ kāgɨ̄ nè lé lèl̄ lám,Le fruit de cet arbre est un peu sucré
07/09/2022 17:36:36,,Lám bàá bè,seulement un peu
07/09/2022 17:37:19,,Ngōn lé tō lám bà ɓō àsɨ̀ ɗā kùlà ə̀ĺ,"L'enfant est tout petit, il ne peut pas travailler"
07/09/2022 17:37:45,,Mə̀m lé tō dā gɨ́ lám gɨ́ sɔ̀ kúdū yā̰,Le rat de Gambie est un petit animal qui mange beaucoup le fruit de l'arbre Detarium microcarpum
07/09/2022 17:38:09,,Ndò̰ kìyā lì-á àdɨ̄ làm-làm,Son couteau est très tranchant
07/09/2022 17:38:38,,Pà tà lám-lám nà m-ā m̄-gə̀r̄ ə̀ĺ,Parle lentement ou je ne vais pas comprendre
07/09/2022 17:39:08,,Lápíyà lə̀-í,Salut à toi
07/09/2022 17:39:26,,"òý-yō, lápíyà yàá","Oui, salut bien"
07/09/2022 17:39:51,,Lò gɨ́ ɓē lə̀-ḿ tò lápíyà kàrī ɓí,Chez moi cela va encore bien
07/09/2022 17:40:12,,Làr gòdó jī-ḿ dɨ́,Je n'ai pas d'argent
07/09/2022 17:40:33,,Làr lé kə̀m-é tɔ̄ ɓō sán̄g də̀w̄ jē ə̀ĺ,"L'argent est aveugle, il ne cherche pas les gens"
07/09/2022 17:40:53,,Sé làr kòsɨ́ lə̀-í lé kándɨ́ wà?,Le prix de tes concombres est à combien?
07/09/2022 17:41:16,,Kūnjá lə̀-í nè làr-é kándɨ́ wà?,"Ta poule là, son prix est combien?"
07/09/2022 17:41:38,,m̄-tɔ́ kīr lé gɨ̀ kùlā làr njɨ́m-njɨ́m,J'ai attaché le fagot fortement avec le fil de fer
07/09/2022 17:42:00,,Lāsɨ̄ rɔ̄-í dɨ́,Tant pis pour toi
07/09/2022 17:42:34,,Tɔ̄l ngán jē láw lé tō gə̄ ngōn-kə̀m Ngàmbáy jē,Le rite d'initiation des jeunes hommes est la prunelle des yeux des Ngambays. L'idiot va à l'initiation mais ne se marie pas
07/09/2022 17:42:57,,Kó̰ də̀w̄ jē àsɨ̀ láw ə̀ĺ,La mère de quelqu'un ne suffit pas pour l'initiation 
07/09/2022 17:43:24,,tɔ̄l láw,faire l'initiation
07/09/2022 17:43:47,,láw-bòdò,enfant initié tout petit
10/09/2022 00:46:03,,Ngán jē lé d-ó̰ mùrū lé láy, Les enfants ont mangé toute la boule
10/09/2022 00:46:36,,ùn ngōn dɨ̀ bə̀gə̀rə̀ láy ùnd-á dɔ̀-á dɨ́,Il prit l'enfant sur la planche (entièrement) et la posé sur sa tête
10/09/2022 00:47:07,,Gúsù lē gòdó jī-á dɨ́ kō lē gòdó,Il n'a ni argent ni mil
10/09/2022 00:47:47,,Lé ī gòdó dáà m-ā kùy yò ɓō,Si tu n'avais pas été là je serais mort de faim
10/09/2022 00:48:12,,Lé āw ndɔ̀ɔ̄-ɔ́ yàá kàrà ā ɗā kùlà ə̀ĺ,"Même si tu vas au champ, tu ne travailleras pas"
10/09/2022 00:48:39,,Dìngàm lé ɗèē,L'homme est venu
10/09/2022 00:48:59,,Ngōn gɨ́ m-ī-é tàgɨ́-nè súgɨ̀ dɨ́ lé tō ngōn-í.,L'enfant que j'ai vu au marché hier c'était ton fils.
