Timestamp,Email address,sba,fr
16/08/2022 23:32:24,,ɗó lé də̄sɨ́ njóróng mḛ̀ ɓē gɨ́ lə̀-sí,Le chemin passe directement par notre village
16/08/2022 23:32:44,,ā tò ɓē lə̀ ná̰ wà?,Tu vas loger chez qui?
16/08/2022 23:33:07,,Mbáy gòdó ɓē-é,Le chef n'est pas à la maison
16/08/2022 23:33:27,,Bàdɨ̄ jē ɓə̄ĺ ɓéē-dé jē yā̰ ùndā bḭ̄yā̰ jē,Les moutons ont plus peur de leurs propriétaires que les chèvres
16/08/2022 23:33:54,,ìlā kùmā kènéng ɓə̄-dɨ̀ tɔ̄l-é-né,Il a versé du poison pour le tuer
16/08/2022 23:34:17,,ɓə̄-dɨ̀ úwá jī-á ā-m̄,Pense bien à le saluer de ma part
16/08/2022 23:34:37,,ɓə̀dɨ̄ lé tá nà̰ā̰ gɨ̀ bàngɨ̀rà nè ḛ̀ tḛ́ bàá,"Le singe est pareil au cynocéphale, mais il est plus petit"
16/08/2022 23:35:03,,ɓə̄r mbī dàlè,Tendre la peau du tambour en donnant des coups sur les bords
16/08/2022 23:35:24,,ḛ̀ lé ɓə̄r tàr yā̰ léè,Lui il est très têtu
16/08/2022 23:35:43,,óm̄ màn̄ lé ā-m̄ sə̀-í ɓə́y,"Donne-moi encore de l'eau, s'il te plaît"
16/08/2022 23:36:05,,K-únd-á sár-sár ɓá d-ḭ́yā̰-á ɓə́y,"Ils le frappaient pendant longtemps, puis ils l'ont laissé"
16/08/2022 23:36:27,,ɗéèē ə̀ĺ ɓə́y,Ils ne sont pas encore venus
16/08/2022 23:36:53,,M-ā m-ō Njàménà gɔ̀l kárā ə̀ĺ ɓə́y,Je n'ai jamais vu N'djaména
16/08/2022 23:37:16,,Né gɨ́ ɓə́y-ɓə́y lèl̄ dā jē ɓō lèl̄ də̀w̄ jē ə̀ĺ,Une chose répétée et répétée plaît les animaux mais pas les hommes
16/08/2022 23:37:41,,m̄-ndó né yā̰ tìl gɨ́ ndáà m̄-tò ɓī ə̀ĺ,"J'étudie beaucoup la nuit, je ne dors pas"
16/08/2022 23:38:07,,"Ngōn kárā, ɓī ɗā kə̀m-é yā̰",L'un des enfants avait très sommeil
16/08/2022 23:38:28,,āw ɓē-é ə̀ĺ ɓí wà?,Tu n'es pas encore rentré chez toi? 
16/08/2022 23:38:48,,ā tél kàw̄ yàá ɓí wà?,Est-ce que tu vas encore repartir?
16/08/2022 23:39:16,, Tènjì òō mɔ̀ngɨ̀r-é ɓá ùndā ùbū ɓí,L'abeille mesure sa force d'abord et après produit du miel
16/08/2022 23:39:41,,Kùlà ɓìndī gɔ̀l-é gɨ́ àr̄-é òsō,La corde s'est enroulée au pied et il est tombé
16/08/2022 23:40:02,,Kə́m ɓìndī rī-á jám gɨ́ lə̀ gádɨ́-màgār.,La mouche s'enroulait dans la toile d'araignée
16/08/2022 23:40:28,,Wàsɨ̄ gɨ́ ndɔ̀ɔ̄ dɔ̀ ɓìr-ɓìsī-lò gɨ́ d-úlá pə̀r lé àndɨ̄ màjì yā̰,Le melon labouré sur le tas d'ordures brûlées produit très bien
16/08/2022 23:41:00,,N-àw̄ ə̀ĺ ɓò,Il ne part pas 
16/08/2022 23:41:22,,Ndī ə̀r ə̀ĺ àr̄ ɓō ò̰ də̀w̄ jē yā̰,La pluie n'est pas tombée et la faim rongeait les gens
16/08/2022 23:42:05,,"ɓō ɗā-m̄ yā̰, nè āw gɨ̀ né-sɔ̀ wà? ","J'ai beaucoup faim, as-tu quelque chose à manger?"
16/08/2022 23:42:40,,Mā̰ ɓá ɓār-m̄ ɓō ī ə̀ĺ,"C'est moi qu'on appelle, et non toi"
16/08/2022 23:43:13,,Né gɨ́ ɓə́y-ɓə́y lèl̄ dā jē ɓō lèl̄ də̀w̄ jē ə̀ĺ,Une chose répétée et répétée plaît les animaux mais pas les hommes
16/08/2022 23:43:42,,"Dáà, ɓō-dɨ̀ úwā jī-á ā-m̄","Alors, il faut lui dire bonjour de ma part"
16/08/2022 23:44:06,, ɓō-gɨ̀ ɗèē gɨ̀ ngōn lé ā-m̄-é,Il faut que tu amènes l'enfant pour moi
16/08/2022 23:44:37,,"Màn̄ lé ɓòbɨ̀ yā̰, ɓō màjì kàӯ èĺ","Cette eau est très boueuse, alors elle n'est pas bonne à boire"
16/08/2022 23:44:57,,Sé ɓōgɨ́-nè də̀w̄ kárā yàá kàrà ɗā kīdō ə̀ĺ wà? ,Est-ce qu'aujourd'hui il y a au moins une personne qui ait fait de la bière?
16/08/2022 23:45:16,,Jḛ̀ḛ̄ j-ìsɔ̀ né yā̰ ɓōgɨ́-nè ndáà rɔ̄ də̀w̄ jē láy yàá lèl̄-dé,"On a bien mangé aujourd'hui, et tout le monde est content"
16/08/2022 23:45:42,,Bàdàkúmbá ɓògò gúsù lə̀ kàgá lə̀-ḿ ɗə́bə́,L'apprenti-chauffeur a volé l'argent de mon grand-père sur la route
16/08/2022 23:46:04,,D-úwá dɔ̀ ɓògò dɨ́,On l'a pris pendant le vol. Expr: njè-ɓògò -voleur
16/08/2022 23:46:28,,Ndàm ùndà ɓòng-é pə̀r dɨ́,L'écureuil plonge sa queue dans le feu
16/08/2022 23:46:54,,ɓòng kə̀r̄ lé gɔ̀jì yā̰ ùndā ɓòng màn̄g,La queue de l'éléphant est plus courte que la queue du boeuf
16/08/2022 23:47:16,,Jímī lé tō yèl̄ gɨ́ ndùl gɨ́ ɓòng-é ngāl,Le drongo est un oiseau noir avec la queue longue
16/08/2022 23:47:45,,ɓòyò jē bùlà yàá à ɗā-dé ɓá à sɔ̀ ɓə́y,"La plupart des champignons, il faut les traiter avant de les manger"
16/08/2022 23:48:14,,Gél ɓɔ́l lə̀-ḿ mbùdù,Le fond de ma poche est percé
16/08/2022 23:48:34,,"Dùl ìsì mḛ̀ ɓɔ́l dɨ́ lé, ùr mbī-á òō-né pà lé",La biche était dans le sac et écoutait cette chanson
16/08/2022 23:49:00,,ḛ̀ mbūsū kūbū jē lə̀-á mḛ̀ ɓɔ́l gɨ́ ndáà gès-é gɨ́ nà̰y lé òm-dé mḛ̀ kàrè gɨ́,"Ses vêtements étaient bourrés dans le sac et ce qui restait, il les a mis dans le panier"
17/08/2022 23:09:23,,ɓɔ́l ngōn lé bòý yā̰,La joue de l'enfant est très grosse
17/08/2022 23:10:08,,ɓɔ̄n jē d-ál kāgɨ̄ gɨ́ yā̰ nè dèné jē gɨ́ mḛ̀ ɓē gɨ́ d-ísɔ̄ dé ə̀ĺ,Les écureuils montent beaucoup dans les arbres. Les femmes dans les villages ne les mangent pas
17/08/2022 23:11:13,,Bɔ̀-ḿ jē lé ɓúgā yā̰ ɓō tɔ́g-é kàr̄ ɗā-né kùlà gòdó,Mon père est déjà vieux; il n'a plus la force de travailler
17/08/2022 23:11:34,,Bɔ̀-ḿ jē ɓúgā yā̰ àsɨ̀ njā ə̀ĺ ngàā,"Mon père est très vieux, il ne peut plus marcher"
17/08/2022 23:12:01,,Mbàw jē gɨ́ d-ɔ́sɨ̄ kānjī ɓūl-màn̄ gɨ́ lé d-úwā kānjī yā̰,Les pêcheurs qui font la pêche dans l'eau profonde attrapent beaucoup de poissons
17/08/2022 23:12:25,, à túngā-né ɓúl-ndà,Il va griller des pois de terre
17/08/2022 23:12:48,,ɓúngā nà̰ā̰ ɗéèē,Ils viennent en masse
17/08/2022 23:13:11,,Kó̰-dèné jē d-áw d-úwā ɓùr kō gɨ́,Les vieilles femmes glanent le champ de mil
17/08/2022 23:13:38,,D-úlā-m̄ dɨ̀ kùlà,Ils m'ont envoyé avec une commission
17/08/2022 23:13:58,,D-áw kōrē mùrū gɨ̀ ndùjī kō,On prépare la boule avec la farine du mil
17/08/2022 23:14:21,,Kùmā gɨ́ d-á-m̄ lé màjì yā̰,Le médicament qu'ils m'ont donné est très bon
17/08/2022 23:14:43,,Dā wúl gɨ́ nàjì lé dɔ̀ nà̰ā̰-dɨ́,Rassemble les arachides étalées en tas
17/08/2022 23:15:06,,Kàndɨ̄ dā lé lèl̄ yā̰ ùndā kàndɨ̄ mbɔ̀r,Le fruit de l'arbre Sterculia setiger là est plus délicieux que le fruit de la pomme cannelle
17/08/2022 23:15:35,,Dā kō tò wə̄ĺ-nè yā̰,Il y a beaucoup de repousses de mil cette année
17/08/2022 23:16:28,,Mə̀m-é jē lé tɔ̄l dā àr̄-é,Ses beaux-parents lui tuèrent une bête
17/08/2022 23:17:02,,Kə̀r̄ lé tō dā gɨ́ bòý ùndā màr̄-é jē,L'éléphant est un animal qui est plus grand que les autres
17/08/2022 23:17:36,,Rɔ̄-á lèl̄-é yā̰ pà nà n-ìngà dā ngàā ,"Il était content, se disant qu'il avait trouvé de la viande maintenant"
17/08/2022 23:17:58,,Ná̰y gɨ́ kɔ̄r dā gòdó kènéng lé lèl̄-m̄ yā̰,J'aime beaucoup la sauce sans des morceaux de viande
17/08/2022 23:18:28,,"ī dá, bàń ɓá āw mbə́ sə̀-ḿ yā̰ bè wà?","Toi là, comment te moques-tu de moi ainsi?"
17/08/2022 23:18:59,,Ndìsā dàā lé ngà̰ā̰ yā̰ ùndā ndìsā púrpù,"Le balai de l'herbe Loudetia simplex est plus résistant que le balai de l'herbe ""purpu"""
17/08/2022 23:19:24,,"Bè dáà, j-àw̄ tā","Si c'est ainsi alors, partons"
17/08/2022 23:19:49,,"Bè dáà, ī-ɗèē dɨ̀ ngàlì ā-m̄","Alors, rapporte du manioc pour moi"
17/08/2022 23:22:17,,Dā-kàsɨ̀ tànjì lé lèl̄ yā̰ ùndā ká̰ kūnjá,La chair de la pintade est plus succulente que celle du poulet
17/08/2022 23:21:52,,Ndɔ̄ nè m-ō màm gɨ́ ùr ngōn dā-kāl,Ce matin j'ai vu un boa avaler une petite antilope
17/08/2022 23:23:19,,Dā-màn̄ lé tō dā gɨ́ tō mḛ̀ bā gɨ́ Lèrēé yàá kárā bà.,Le lamantin est un animal qui habite seulement dans le lac de Léré
17/08/2022 23:23:41,,Dā-rɔ̄ də̀w̄ lé à kòy yàá,Le corps humain va mourir! 
17/08/2022 23:24:00,,ùndà dɔ̀ nàng dàaa,Ça a disparu subitement
17/08/2022 23:24:31,,"ī-dàbɨ̀ yā̰, ngàb-í à kàr̄-ī né ə̀ĺ","Tu es très paresseuse, ton mari ne te donnera rien"
17/08/2022 23:24:51,,M-úbā pə̀r nàńg gɨ̀ dàbɨ̀là gɔ̀l-ḿ,J'ai piétiné le feu sur la terre avec la plante de mon pied
17/08/2022 23:25:14,,Dàbɨ̀là jī-ḿ ùndā mḭ̀ḭ̄,J'ai de callosité aux mains
17/08/2022 23:25:41,,Dàdɨ̄ kándɨ̄ kō lé dɔ̀ nà̰ā̰ dɨ́,Entasse les grains de mil ensemble
17/08/2022 23:26:03,,ɓōlé úwā njè-ɓògò ndáà à dàdɨ̄,Si tu attrapes un voleur il va trembler
17/08/2022 23:26:28,,Dàgɨ̀yà lé kḭ́-á jē ùnd-á dàn kèm-é gɨ́,"L'enfant unique, sa mère le pose dans ses yeux (elle l'aime beaucoup)"
17/08/2022 23:26:53,,ùndà dákàl,Il a plongé en tapant les jambes
19/08/2022 17:43:20,,Dálá lé tō ndām rɔ̄-lèl̄ gɨ́ də̀w̄ jē ndām lò-ndùl gɨ́,"La ""dala"" est une dance de joie que les gens dansent la nuit"
19/08/2022 17:43:48,,òdō kúndū jē òdō dàlè jē àw̄ gɨ́ gō Sú dɨ́ lé,"Il prend des balafons, il prend des tambours et s'en va à la recherche de Su"
19/08/2022 17:44:13,,"ɓē lə̀ Ngàmbáy jē lé gél dàlè jē ɓə́dɨ́-ɓə́dɨ́, gán̄g lə́m, kɔ̀dɨ̀ lə́m-á, màsàng lə́m tɔ̀","Il y a différents types de tambours chez les Ngambay: le ""gang"", le ""kode"", le ""masang"" et d'autres encore"
19/08/2022 17:44:47,,ḛ̀ tō dèné gɨ́ àw̄ njā dàlɨ̄m kàrī bàá,C'est une femme qui ne fait que vagabonder sans travailler
19/08/2022 17:45:07,,Ngàb-é lé àw̄ sə̀-á ìlā dàm-á,Son mari le prend et le dépose dans le grenier
19/08/2022 17:45:30,,Dàm lé tō lò ngə̄m kō,Le grenier est un endroit pour garder le mil
19/08/2022 17:45:57,,Ngōn lé òdō jó dɔ̀ dām-é gɨ́,L'enfant porte la jarre sur la partie supérieure de l'épaule
19/08/2022 17:46:17,,ḛ̀ àw̄ dám né-sɔ̀ mbā kàr̄ mḛ̀-é ndān,Il est parti glaner de la nourriture pour qu'il soit rassasié
19/08/2022 17:46:45,,ìlā mə̀r dámsā,Il porte un collier de perles croisé
19/08/2022 17:47:06,,Də̀w̄ jē d-ílā mùrū lé dàn-á ɓá d-ó̰,Les gens mettent la boule au centre pour la manger
19/08/2022 17:47:23,,"Sé dàn-dé dɨ́ mùndá nè lé, ná̰ ɓá ɗā gōsū yā̰ wà? ","D'entre ces trois personnes, quelle a été la plus maligne? "
19/08/2022 17:47:49,,ɗā né lé dān-é-né,Fait ça pour l'accompagner
19/08/2022 17:48:09,,M-ā dān-ī ɗə́bə́,Je vais t'accompagner en route
19/08/2022 17:48:38,,Lél dān-é,Le vent souffle légèrement sur lui
19/08/2022 17:48:59,,ḛ̀ òng màn̄ mḛ̀ ngórō gɨ́ ndáà òm kàdɨ̄ dàn-gɨ́, Elle a versé l'eau dans le canari et a mis le sel dedans
19/08/2022 17:49:24,," Dàn-kàrá lé, ī-ɗā ɗí wà? ","à midi, qu'est-ce que tu as fait?"
19/08/2022 17:49:45,,Dàn-lò bàbɨ̀ yàá ngōn lé tḛ̀ḛ̄ kə̀m-é nō̰,En plein milieu de la nuit l'enfant a ouvert ses yeux et a pleuré
19/08/2022 17:50:07,, Ndī lé ə̀r yā̰ àr̄ màn̄-é àr dàng mḛ̀-kə́y gɨ́,La pluie est beaucoup tombée et l'eau a formé une flaque dans la concession
19/08/2022 17:50:32,,Mā̰ lé m̄-tó də̀w̄ gɨ́ dāng-dɨ́ ɓō də̀w̄ dɔ̀-ḿ gòdó,Moi je suis quelqu'un sans protection et je n'ai personne pour m'aider
19/08/2022 17:50:59,,Dāng-dɨ́ ɗā-m̄,Je suis pauvre
19/08/2022 17:51:44,,Ngōn gɨ́ dāng-gɨ́ lé tɔ̄l dā ɗə́bə́ ə̀ĺ,L'enfant sans protection ne tue pas un animal sur la route
19/08/2022 17:52:14,, Kándɨ̄ dángá lé ōlē āy ndáà à kɔ̀r̄ mò̰y rɔ̄-núngā dɔ̀-í gɨ́,"Les grains de l'arbre Balanites aegyptiaca là, si tu les boues pour boire (le jus) alors il va soigner la maladie de la fièvre (typhoïde)"
19/08/2022 17:52:37,,D-úw-á dàngá̰ỳ,Il est en prison
19/08/2022 17:53:02,,Dèné lì-á ùn kāgɨ̄ ùndà-né dàngɨ̀rà-dì-á tɔ̄l-é,Sa femme a pris un bois et l'a frappé avec en plein milieu de sa tête et l'a tué
19/08/2022 17:53:27,,Lò ndùl gɨ́ lé ḛ̀ dàr jīgī kāgɨ̄ àr̄ gɔ̀l-é tò dò,Dans l'obscurité il a heurté contre une souche et son pied est blessé
19/08/2022 17:53:52,,M-ā kà̰ӯ màn̄ kɨ́ dàrā = M-ā kà̰ӯ màn̄ gɨ́ dàrā,Je boirais bien de l'eau du ciel
19/08/2022 17:54:21,,Ndī ìl̄ dàrā yā̰,Les nuages couvrent complètement le ciel
19/08/2022 17:54:50,,à ndó dásɨ̄m,Il mène une vie oisive
19/08/2022 17:55:13,,Lò-gɨ́ òō tà tújī gɨ́ tḛ̀ḛ̄ dɔ̀ ngō-kḭ́-á gɨ́ ndáà yḛ̀ tūŕ dásɨ̄m,Quand il a écouté le malheur de son frère il s'est torturé tout seul
19/08/2022 17:55:42,,"m̄-dàw yā̰, m-ā tò nàńg sḛ́","Je suis très fatigué, je m'étends un peu"
19/08/2022 17:56:03,,m̄-ɗā kùlà yā̰ ndáà ɓàsí-nè m̄-dàw yā̰,J'ai beaucoup travaillé et maintenant je suis fatigué
19/08/2022 17:56:25,,Njè-ndɔ̀ɔ̄ lé ùnjà kō lì-á ndáà tɔ́sɨ̄ dàm-á dáy-dáy,Le cultivateur a récolté son mil et l'a disposé dans le grenier sans rien perdre
19/08/2022 17:56:46,,ɗèē sè-dé wà?,Es-tu venu avec eux?
19/08/2022 17:57:04,,Yḛ̀ àr̄-dé né d-ísɔ̄,Il leur a donné à manger
19/08/2022 17:57:35,,D-áw dɔ̀ nà̰ā̰ dɨ́ dém-dém,Ils se rassemblent beaucoup
19/08/2022 17:57:57,,Tō də̀w̄ gɨ́ dèné sé dìngàm wà?,Est-ce une femme ou un homme? 
19/08/2022 17:58:23,,Dèné lé nā̰ ná̰y ndáà lèl̄ tì-á gɨ́ yā̰ àr̄-é ùsɔ̀ láy,"La femme a goûté la sauce, et elle l'a aimée tellement qu'elle a toute mangée"
19/08/2022 17:59:16,,Dèné lə̀-ḿ ,ma femme 
19/08/2022 17:59:39,,ɓōlé dèné lə̀-ḿ òō né ndáà ndīngā,Si ma femme voit quelque chose elle la désire
19/08/2022 18:00:07,,Ngōn gɨ́ déngél,garçon tout petit et beau
19/08/2022 18:00:28,,Màn̄ ùlà déréré-dèrèrè,L'eau oscille
19/08/2022 18:00:51,,Dḛ́ lé d-áw ngàā,Ils sont déjà partis
19/08/2022 18:01:26,,Dḛ́ӯ mḭ́,Ils sont cinq
19/08/2022 18:01:46,,àl̄ tàŕ ùr gél búdū dɨ́ dɨ̀ mbā kùsà də́r dḛ́ӯ dɨ̀ ngán-é, Il bondit au lieu guetté pour attraper le pigeon et ses petits
19/08/2022 18:02:06,,òō də́r dḛ́ӯ sə̀ ngán-é ń-tò kèné,Il vit le pigeon avec ses petits qui étaient dedans
19/08/2022 18:02:40,,Njà-ḿ-gòdó dḛ́ӯ dɨ̀ Sú d-áw d-íyā gūm,Njamgoto et Sou allèrent poser des pièges
19/08/2022 18:03:02,,M-āw-né də̄ súgɨ̀ dɨ́,Je les emporte au marché
19/08/2022 18:03:25,,ḭ̀ də̄ súgɨ̀ dɨ́ jēń,Peut-être revient-il du marché
19/08/2022 18:03:48,,Tḛ̀ḛ̄ tà màn̄ bā dɨ́ də̀bə̀,Ils marchent longtemps et ils arrivent tout près d'un fleuve
19/08/2022 18:04:09,,Kə́y lə̀-á tō də̀bɨ̀ gɨ̀ ká̰ mā̰,Sa maison est proche de la mienne
19/08/2022 18:04:34,,Bàbá lé gāng də̄bə́ lò-ndɔ̀ɔ̄ lì-á ā-m̄ m̄-ndɔ̀ɔ̄ sì-á wə̄ĺ-nè,Papa a divisé la moitié de son champ pour que je puisse cultiver avec lui cette année
19/08/2022 18:05:00,,D-ḭ́ lò gɨ́ də̀bɨ̀ nè yàá ɗéèē,Ils viennent d'un lieu plus proche
19/08/2022 18:05:23,,Lēbɨ̄ ɗɔ̄ jē lé m-ā̰y m-āw m̄-də̀bɨ̀ wàlá,"Pendant les années de guerre, j'ai fuit pour me cacher en brousse"
19/08/2022 18:05:44,,Ngōn-gɨ́-dèné lé ùn jó lə̀ kḭ́-á jē gɨ́ bòý yàá də́bɨ̄ nàńg,La jeune fille a prit la grande jarre de sa mère et l'a renversée à terre
19/08/2022 18:06:18,,m̄-də̀j-ī gōsū ɗā ùbū ɗɔ̄ý,Je te demande comment on fait l'huile de karité
19/08/2022 18:06:40,,Də̀jì-m̄ kà-m̄ m̄-lá sà-á ndáà m̄-ndìgì sà-á,Il m'a demandé d'aller l'aider et j'ai accepté
19/08/2022 18:07:02,,Wúl lé à-m̄ də̀jì yā̰,Les arachides me font roter beaucoup
19/08/2022 18:07:26,,Də̄ĺ lé tō kānjī gɨ́ lèl̄ yā̰ nè sīngā-á ɓá yā̰ yā̰,L'Alestes baremoze est un poisson qui est délicieux mais il a beaucoup d'arêtes
19/08/2022 18:07:49,,Njè-bàdà-kə́y lə̀-ḿ də̄ń ɗə́bə́ gɨ̀ bèlóò,Mon voisin est passé sur le chemin avec son vélo
19/08/2022 18:08:08,,Də̀w̄ túngā də̀r ndɔ̄ ɗɔ̄ dɨ́ ə̀ĺ,On ne tresse pas le bouclier le jour de la guerre
19/08/2022 18:08:29,,Ngōn də̀r̄-ḿ lé tō ngōn gɨ́ dìngàm,Mon enfant aîné est un garçon
19/08/2022 18:08:58,,mbàl̄ gɨ́ Ngàw-ndērē lé də̀r̄-é ngāl ùndā də̀r̄ ḛ̀ gɨ́ Lērē,"La montagne de Ngaoundéré, son sommet est plus haut que le sommet de celle de Léré"
19/08/2022 18:09:30,,Də́r lé dā-kàs-é kūl yā̰ ùndā ká̰ də̄ĺ,"Le poisson Citharinus citharus là, sa chair est plus tendre que celle du poisson Alestes baremoze"
19/08/2022 18:09:50,,Gūm lə̀-á ùwà də́r,Son piège prit un pigeon
19/08/2022 18:10:19,,Tūbā də́r jē dɔ̀ kō gɨ́ nà d-á kò̰,Chasse les pigeons du mil pour qu'ils ne le mangent pas
19/08/2022 18:10:47,,Ngō-kó̰-ḿ gɨ́ tɔ̀gɨ̀ lé ḭ̀ Bàngī ɗèē gɨ̀ dìmásɨ̀ gɨ́ də̄sɨ́ nò̰ó̰,Mon grand-frère a quitté Bangui et est venu ici la semaine passée
19/08/2022 18:11:09,,Dìngàm gɨ́ à̰ẃ lé ndə̀r̄ dìmsì,Cet homme qui est là-bas est très costaud
19/08/2022 18:11:30,,m̄-tó̰ nàng tɔ́gɨ̄ dɨ́ lé àr̄ dɔ̀-ḿ dìngà yə̀r-yə̀r,J'ai croqué du sable dans les grains de mil et ma tête vibre
19/08/2022 18:11:47,,"ḛ̀ àw̄ gɨ̀ ngán jē sīrí, dìngàm jē mùndá, dèné jē sɔ́","Il a sept enfants, trois garçons et quatre filles"
19/08/2022 18:12:15,,"òý-yō, òjì ngōn kɨ́ dìngàm","Oui, elle a mis au monde un garçon"
19/08/2022 18:12:39,,Tō ngōn gɨ́ d-úndā gɨ̀ kás-é bàá d-ár-é dìngɨ̀rī,C'est un enfant qu'on a tapé depuis qu'il est petit et l'a rendu têtu
19/08/2022 18:13:01,,Dīrí lé ká̰-dé lèl̄ tà màn̄g jē gɨ́ yā̰,"L'arbre Acacia albida là, les boeufs aiment beaucoup leurs grains"
19/08/2022 18:13:41,,Tém dìrò lé də̀w̄ jē tə́dɨ̄ náājī-né,"Le gui de l'arbre Combretum glutinosum là, les gens le cassent pour jurer avec"
19/08/2022 18:14:11,,Dḭ̀ ɓɔ́l jē gɨ́ nṵ́ lé jōó bɔ́r ɗèē-né,Ramasse ses deux sacs là-bas ensemble pour les amener ici
19/08/2022 18:14:36,,M-ā m-dḭ̀ḭ̄ gē-é,Je le poursuis
19/08/2022 18:14:57,,Tò dḭ̀yò̰ sé dèné wà?,Est-il homme ou femme?
19/08/2022 18:15:23,,ā ā̰y ngɔ̄dɨ̄ dɨ̀ mbā-ɗí wà?,Tu cours pour quelle raison?
19/08/2022 18:15:42,,Mḛ̀ ɓē dɨ́ gɨ́-ɗá wà?,Dans quel village?
19/08/2022 18:16:05,,ɗí ā ɗā bèlè dɨ̀-sḭ́ wà?,Qu'est-ce que tu vas faire demain matin?
19/08/2022 18:16:26,,ɗèē dɨ̀ pə̀r ā-m̄ m-ō-né dò nè,Apporte du feu pour que je voie cette blessure
19/08/2022 18:16:48,,Dò gɨ́ gɔ̀l-ḿ lé ɔ̀gɨ̄-m̄ dɔ̀ njā,La plaie sur mon pied m'empêche de marcher
19/08/2022 18:17:09,,Dō jē tújī mángò lə̀-ḿ,Les chauves-souris détruisent mes mangues
19/08/2022 18:17:41,,Dō-dòngò lé sɔ̀ mángò yā̰,La chauve-souris grosse mange beaucoup de mangues
19/08/2022 18:18:00,,Dō-ngír-ngá̰y lé ùdū mbī lò yā̰,Les chauves-souris de maison font beaucoup de bruit
19/08/2022 18:18:21,,"M-āw də̄ dòktúr̀ dɨ́, m-ḭ́yā̰-sí ngàā","Je vais au dispensaire, je vous laisse maintenant"
19/08/2022 18:18:42,,Dìngàm nè lé dòlè dɔ̀-kə́y lì-á gɨ̀ mṵ̀,Cet homme couvre le toit de sa maison avec la paille
19/08/2022 18:19:07,,M-úlā kūbū gɨ́ mbùdù dóróng,Je porte une chemise qui est complètement trouée
19/08/2022 18:19:27,,Ná̰y lə̀-í lé kàdɨ̄ dò̰ kə̀nə́ng yā̰,Ta sauce est trop salée
19/08/2022 18:19:48,,ùbà dò̰dò̰ mbùdù òsō kə̀nə́ng,Il a piétiné la termitière et l'a percée et il est tombé dedans
19/08/2022 18:20:17,,M-āw dɔ̀ kāgɨ̄ gɨ́ mbā kòō né jē,Je monte dans l'arbre pour veiller
19/08/2022 18:20:36,,ndə́l dɔ̀ ɓī dɨ́,se réveiller
19/08/2022 18:21:15,,ùn bèl̄ kūnjá ùlà dɔ̀-á dɨ́ ɗā-né bàsá,Il prend les plumes (du poulet) et les met sur sa tête pour faire le jeune homme
19/08/2022 18:21:39,,Dɔ̀-ḿ tō-m̄,J'ai mal à la tête
19/08/2022 18:22:07,,Tàr lə̀-í lé m-ō dì-á ə̀ĺ,Je n'arrive pas à comprendre le sens de ce que tu dis
19/08/2022 18:22:49,, ḭ̀yà̰ ngōn lé dì-á dɨ́ bàá yàá,Il a laissé l'enfant seul sans aucune surveillance
19/08/2022 18:23:05,,M-āw də̄ dɔ̀-í dɨ́,Je vais chez toi 
19/08/2022 18:23:34,,m̄-tɔ̄l tà kùlà lə̀-ḿ dɔ̀-í dɨ́,J'ai fini mon travail avant toi
19/08/2022 18:23:55,,M-ūndā mə̀-ḿ dɔ̀-í dɨ́,Je compte sur toi
19/08/2022 18:24:25,,Tàr lə̀-í lé dì-á ùdù,"Ton affaire, on ne s'en occupe plus"
19/08/2022 18:24:49,,ìyā sə̀-sí dɔ̀ gúrsù gɨ́ d-ár-é lé,Il nous a caché l'argent qu'on lui a donné
19/08/2022 18:25:12,,"Lò-gɨ́ ùndā dɔ̀-dé dáà, ngḛ̀y léb-léb","Quand il est arrivé près d'eux, il avança à pas feutrés"
19/08/2022 18:25:55,,Dòktúr̀ lé ɔ̀sɨ̀ dɔ̀-bāgɨ̄ ngōn lé,Le médecin a donné l'injection à l'épaule de l'enfant
19/08/2022 18:26:24,,Dḛ́ d-ún nīń d-áw-né dɔ̀-ɓár gɨ́,Ils ont pris le cadavre et l'ont amené au cimetière
19/08/2022 18:26:52,,Nān-é jē ɗā kə́y lì-á dɔ̀-də̀r̄-lò gɨ́ tàŕ,Son oncle a fait sa maison en haut sur le monticule
19/08/2022 18:27:19,,Tə̰̄y gɨ́ ndɔ̀ɔ̄ kàr dɔ̀-gɨ́-dīí lé àndɨ̄ màjì yā̰,Le petit mil labouré à côté des termitières produit très bien
19/08/2022 18:27:46,, Kàr lé ùbà bə̀ŕ àndɨ̄ dɔ̀-gó,Le soleil se lève à l'est et se couche à l'ouest
19/08/2022 18:28:10,,Dḛ́ sán̄g dɔ̀-gɔ̀l-sí sár tḛ̀ḛ̄ nè,Ils ont suivi vos traces jusqu'ici
19/08/2022 18:28:36,,īlā dɨ̀ dɔ̀-jī-í,Pose-le toi-même
19/08/2022 18:29:07,,Tòbə̰̀y jē láy yàá d-á̰y dɔ̀-nàńg lə̀ Bāyā jē,Tous les lions ont fuit à la terre des Gbaya
19/08/2022 18:29:33,,Pə́n̄ Mùrsál̀ gɨ̀ àrdèpjùmbál̀ lé dɔ̀-ndá tò kènéng.,Entre Moursal et Ardepjumbal il y a un pont
19/08/2022 18:30:02,,"M-ásɨ̄ sɔ̀ dā gɨ́ ngìrà ə̀ĺ, dɔ̀-ngāng-ḿ tí","Je ne peux pas manger cette viande dure, mes gencives sont enflées"
19/08/2022 18:30:26,,Tò dɔ̀-ngɔ̄ bàá,C'est entier
19/08/2022 18:30:45,,Də̀w̄ dɔ̀-ngɔ̄ yàá tɔ̀ɔ́ àr̄-ī lé wà?,Qui donc a été assez bon pour te le donner?
19/08/2022 18:31:10,,"Dɔ̀-ngɔ̀ré, m-āw wàlá m-āw m-ōdō kándɨ̄ ɗɔ̄ý",D'abord je vais en brousse et je ramasse des noix de karité
19/08/2022 18:31:45,,Dɔ̀bɨ̄-m̄ gɨ̀ kə̀m-é,Il m'a fait signe avec ses yeux
19/08/2022 18:32:07,,Dɔ̀dɔ̀-ə̄m lé tō dā gɨ́ mbī-á ngāl yā̰ lə́m gōsū lə̀-á ḛ̀ yā̰ lə́m tɔ̀,"Le lièvre est un animal aux oreilles longues, et il est très malin"
19/08/2022 18:32:33,,Kó̰ kīnjá lə̀-ḿ tɔ̄ ngán jē dɔ̀g-gìr-é-kárā,Ma poule a éclos onze poussins
19/08/2022 18:33:01,,M-úwā kám-mbēdē jē nàńg lò dɔ̀gɨ̀ dɔ̀gɨ̀,J'ai mis les papiers en groupes de dix
19/08/2022 18:33:29,,Dɔ̀gɨ̀ lé bòý tōgɨ́ màn̄g bè nè ɗā dìngàm yā̰,"Le buffle est un animal de la taille du boeuf, mais il est beaucoup plus agressif"
19/08/2022 18:34:01,,"Ngōn-də́r gɨ́ dɔ̀ngɔ̀r lé ùndā rī-á nà ""Njā-ndān-dá""","Le premier petit pigeon, il l'a nomma ""Le renard est déjà rassasié"""
19/08/2022 18:35:07,,Gə̀r̄ ə̀ĺ yàá dɔ̀rɔ̄ ɓí wà?,Tu n'as pas encore compris?
19/08/2022 18:35:35,,D-ár-é kūbū gɨ́ sìgì dɔ̀rɔ́ ɗí-á lèl̄-é-né,"On lui a donné un nouvel habit, c'est pourquoi il est content"
19/08/2022 18:35:56,,Dèné lé dú dɔ̀-lò mbā kòō lī,La femme se dresse sur la pointe des pieds pour voir le serpent
19/08/2022 18:36:20,,àbɨ̀ lé tò dú màn̄ gɨ́,L'hippopotame reste au fond de l'eau
19/08/2022 18:36:40,,Ngōn gɨ́ dūú,un petit enfant
19/08/2022 18:37:03,,D-ún yò kó̰-dé d-áw dùbū,Ils prirent le corps de leur mère et allèrent l'enterrer
19/08/2022 18:37:27,,Ngán jē dúbū làr lé nàńg,Les enfants ont enterré l'argent dans le sol
19/08/2022 18:37:52,,"mā̰ m̄-dùbū, ī-dùbū, yḛ̀ dùbū, jḛ̀ḛ̄ ǹ-dùbū-jē, sḛ̀ḛ̄ ǹ-dùbū-jē, dḛ́ dúbū","j'enterre, tu enterres, il enterre, nous enterrons, vous enterrez, ils enterrent"
19/08/2022 18:38:16,,"Ndī ə̀r̄ nàńg, ɓār-ḿ ā-m̄ m̄-dùbū sə̀-í wúl lə̀-í","Si la pluie arrose bien la terre, appelle-moi que je vienne avec toi semer tes arachides"
19/08/2022 18:38:42,,Ngōn lé ùn dūbū kāgɨ̄ ɗèē-né ɓē-é,L'enfant a pris un morceau de bois et l'a apporté à la maison
19/08/2022 18:39:18,,Lò gɨ́ kṵ́nā̰ jē nō̰ ndáà dūjó-lò-kàr̄ ùbà,Quand les coqs chantent alors l'étoile du matin apparait
19/08/2022 18:39:45,,"M-āw də̄ dùktúr̀ dɨ́, m-íyā̰-ī ngàā","Je vais au dispensaire, je te laisse maintenant"
19/08/2022 18:40:14,,Màn̄ à̰ӯ dùlà-dùlà,L'eau coule à flots
19/08/2022 18:40:42,,Kàr-é ɓār dùlùg-dùlùg,Son coeur bat à grand bruit
19/08/2022 18:41:08,,Dùm kàw̄,C'est impossible d'aller
19/08/2022 18:41:36,,Də̀w̄ dùm̄-ī gɨ̀ ngɔ̄dɨ̄ ndáà ī-dùm̄-é gɨ̀ njā,"Si quelqu'un te dépasse en courant, il te faut le dépasser en marchant"
19/08/2022 18:42:05,,àw̄ gɨ̀ kùd-é dūm bàá,Il est tout nu
